Key,ShortKey,Source,Row,Module,Field,Character,CN,EN,RU,ES,JP,KR,FR,DE,PT,TH,IN,VI
StageGroup_20448_Name,aRfe,g关卡组_StageGroup_A.csv,150,StageGroup,Name,,扭曲核心,Twisted Core,Искажённое ядро,Núcleo Distorsionado,ねじれたコア,뒤틀린 핵,Noyau tordu,Verzerrter Kern,Núcleo Distorcido,แกนบิดเบือน,Inti yang Terdistorsi,Lõi xoắn
StageGroup_20448_Desc,aRfd,g关卡组_StageGroup_A.csv,150,StageGroup,Desc,,她是由弥萨格大学复原而成的人偶。\n 她的骨架是金属，她的心脏是银芯，她的结构无比精妙，即使对着设计图纸，也再难造出第二个。 \n而在她成为冰冷的机械前，她有着一颗人类的心。,"She is a doll restored by Mythag University.\n Her skeleton is metal, her heart is a Silver. Her structure is so intricate that even with blueprints, another cannot be made.\n Before becoming a cold machine, she had a human heart.","Она — кукла, воссозданная Университетом Мисага.\n Её скелет металлический, её сердце — сердечник из серебра, её конструкция невероятно хитроумна, и даже по чертежам невозможно создать вторую такую же.\n До того как она стала холодным механизмом, у неё было человеческое сердце.","Ella es una marioneta restaurada por la universidad de mitag.\n Su esqueleto es de metal, su corazón es de plata, su estructura es extremadamente exquisita; incluso con los planos, es difícil crear un segundo igual.\nAntes de convertirse en una fría máquina, tenía un corazón humano",彼女はミサグ大学によって復元された人偶です。\n 彼女の骨組みは金属で、心臓はシルバーコアであり、その構造は非常に精妙で、設計図を見ても二つと作ることは困難です。\n そして、彼女が冷たい機械となる以前、彼女には人間の心がありました。,"그녀는 미사그 대학이 복원한 인형이다.\n뼈대는 금속으로, 심장은 은심으로 이루어져 있다. 그 구조는 매우 정교하여, 설계도를 본다고 해도 같은 것을 두 번 다시 만들기 어렵다.\n하지만 그녀가 차가운 기계가 되기 전에는, 인간의 마음을 지니고 있었다.","Elle était une poupée restaurée par l'université de Mythag.\nSon squelette était en métal, son cœur en argent, sa structure était incroyablement délicate, même face aux dessins, il était presque impossible d'en construire un autre. \nAvant de devenir une machine glacée, elle avait un cœur humain","Sie ist eine Puppe, die von der Mythag Universität wiederhergestellt wurde.\nIhr Skelett ist aus Metall, ihr Herz aus Silber, ihre Struktur ist unglaublich raffiniert; selbst im Angesicht der Entwurfspläne ist es unmöglich, ein zweites zu schaffen.\nDoch bevor sie zur kalten Maschine wurde, hatte sie ein menschliches Herz","Ela é uma boneca restaurada pela universidade de mythag.\n Sua estrutura é de metal, seu coração é de prata, sua construção é extremamente complexa, mesmo com os desenhos de projeto, é impossível criar um segundo exemplar.\nMas antes de se tornar uma máquina fria, ela possuía um coração humano",เธอเป็นตุ๊กตาที่ถูกสร้างขึ้นใหม่โดยมหาวิทยาลัยมิซากะ \n โครงกระดูกของเธอทำจากโลหะ หัวใจของเธอคือแกนเงิน โครงสร้างของเธอซับซ้อนอย่างยิ่ง แม้มีแบบแปลนการออกแบบ ก็แทบเป็นไปไม่ได้ที่จะสร้างอีกตัวหนึ่งได้ \n และก่อนที่เธอจะกลายเป็นเครื่องจักรที่ไร้ความรู้สึก เธอเคยมีหัวใจของมนุษย์,"Dia adalah boneka yang direkonstruksi oleh Universitas Mythag. \n Kerangkanya terbuat dari logam, jantungnya adalah inti perak, strukturnya sangat rumit, bahkan dengan melihat gambar desain, mustahil untuk membuat yang kedua. \n Sebelum dia menjadi mesin yang dingin, dia memiliki hati seorang manusia.","Cô ấy là một con rối được phục hồi bởi Đại học Misag. \n Bộ xương của cô ấy là kim loại, trái tim của cô ấy là bạc tâm, cấu trúc của cô ấy vô cùng tinh vi, ngay cả khi đối diện với bản vẽ thiết kế, cũng khó có thể tạo ra một cái thứ hai. \n Và trước khi trở thành một cỗ máy lạnh giá, cô ấy đã có một trái tim của con người."
StageGroup_20448_TypeText,aRfg,g关卡组_StageGroup_A.csv,150,StageGroup,TypeText,,意识潜游,Psyche Deepdive,Скиталец,El errante,意識潜航,의식 잠수,Le vagabond,Das Wandern,O errante,ผู้พเนจร,Yang berkelana,Kẻ lang thang
StageGroup_20451_Name,aRfq,g关卡组_StageGroup_A.csv,151,StageGroup,Name,,扭曲核心,Twisted Core,Искажённое ядро,Núcleo Distorsionado,ねじれたコア,뒤틀린 핵,Noyau tordu,Verzerrter Kern,Núcleo Distorcido,แกนบิดเบือน,Inti yang Terdistorsi,Lõi xoắn
StageGroup_20451_Desc,aRfp,g关卡组_StageGroup_A.csv,151,StageGroup,Desc,,她是由弥萨格大学复原而成的人偶。\n 她的骨架是金属，她的心脏是银芯，她的结构无比精妙，即使对着设计图纸，也再难造出第二个。 \n而在她成为冰冷的机械前，她有着一颗人类的心。,"She is a doll restored by Mythag University.\n Her skeleton is metal, her heart is a Silver. Her structure is so intricate that even with blueprints, another cannot be made.\n Before becoming a cold machine, she had a human heart.","Она — кукла, воссозданная Университетом Мисага.\n Её скелет металлический, её сердце — сердечник из серебра, её конструкция невероятно хитроумна, и даже по чертежам невозможно создать вторую такую же.\n До того как она стала холодным механизмом, у неё было человеческое сердце.","Ella es una marioneta restaurada por la universidad de mitag.\n Su esqueleto es de metal, su corazón es de plata, su estructura es extremadamente exquisita; incluso con los planos, es difícil crear un segundo igual.\nAntes de convertirse en una fría máquina, tenía un corazón humano",彼女はミサグ大学によって復元された人偶です。\n 彼女の骨組みは金属で、心臓はシルバーコアであり、その構造は非常に精妙で、設計図を見ても二つと作ることは困難です。\n そして、彼女が冷たい機械となる以前、彼女には人間の心がありました。,"그녀는 미사그 대학이 복원한 인형이다.\n뼈대는 금속으로, 심장은 은심으로 이루어져 있다. 그 구조는 매우 정교하여, 설계도를 본다고 해도 같은 것을 두 번 다시 만들기 어렵다.\n하지만 그녀가 차가운 기계가 되기 전에는, 인간의 마음을 지니고 있었다.","Elle était une poupée restaurée par l'université de Mythag.\nSon squelette était en métal, son cœur en argent, sa structure était incroyablement délicate, même face aux dessins, il était presque impossible d'en construire un autre. \nAvant de devenir une machine glacée, elle avait un cœur humain","Sie ist eine Puppe, die von der Mythag Universität wiederhergestellt wurde.\nIhr Skelett ist aus Metall, ihr Herz aus Silber, ihre Struktur ist unglaublich raffiniert; selbst im Angesicht der Entwurfspläne ist es unmöglich, ein zweites zu schaffen.\nDoch bevor sie zur kalten Maschine wurde, hatte sie ein menschliches Herz","Ela é uma boneca restaurada pela universidade de mythag.\n Sua estrutura é de metal, seu coração é de prata, sua construção é extremamente complexa, mesmo com os desenhos de projeto, é impossível criar um segundo exemplar.\nMas antes de se tornar uma máquina fria, ela possuía um coração humano",เธอเป็นตุ๊กตาที่ถูกสร้างขึ้นใหม่โดยมหาวิทยาลัยมิซากะ \n โครงกระดูกของเธอทำจากโลหะ หัวใจของเธอคือแกนเงิน โครงสร้างของเธอซับซ้อนอย่างยิ่ง แม้มีแบบแปลนการออกแบบ ก็แทบเป็นไปไม่ได้ที่จะสร้างอีกตัวหนึ่งได้ \n และก่อนที่เธอจะกลายเป็นเครื่องจักรที่ไร้ความรู้สึก เธอเคยมีหัวใจของมนุษย์,"Dia adalah boneka yang direkonstruksi oleh Universitas Mythag. \n Kerangkanya terbuat dari logam, jantungnya adalah inti perak, strukturnya sangat rumit, bahkan dengan melihat gambar desain, mustahil untuk membuat yang kedua. \n Sebelum dia menjadi mesin yang dingin, dia memiliki hati seorang manusia.","Cô ấy là một con rối được phục hồi bởi Đại học Misag. \n Bộ xương của cô ấy là kim loại, trái tim của cô ấy là bạc tâm, cấu trúc của cô ấy vô cùng tinh vi, ngay cả khi đối diện với bản vẽ thiết kế, cũng khó có thể tạo ra một cái thứ hai. \n Và trước khi trở thành một cỗ máy lạnh giá, cô ấy đã có một trái tim của con người."
StageGroup_20451_TypeText,aRfs,g关卡组_StageGroup_A.csv,151,StageGroup,TypeText,,意识潜游,Psyche Deepdive,Скиталец,El errante,意識潜航,의식 잠수,Le vagabond,Das Wandern,O errante,ผู้พเนจร,Yang berkelana,Kẻ lang thang
StageGroup_20447_Name,aRfa,g关卡组_StageGroup_A.csv,152,StageGroup,Name,,扭曲核心,Twisted Core,Искажённое ядро,Núcleo Distorsionado,ねじれたコア,뒤틀린 핵,Noyau tordu,Verzerrter Kern,Núcleo Distorcido,แกนบิดเบือน,Inti yang Terdistorsi,Lõi xoắn
StageGroup_20447_Desc,aReZ,g关卡组_StageGroup_A.csv,152,StageGroup,Desc,,她是由弥萨格大学复原而成的人偶。\n 她的骨架是金属，她的心脏是银芯，她的结构无比精妙，即使对着设计图纸，也再难造出第二个。 \n而在她成为冰冷的机械前，她有着一颗人类的心。,"She is a doll restored by Mythag University.\n Her skeleton is metal, her heart is a Silver. Her structure is so intricate that even with blueprints, another cannot be made.\n Before becoming a cold machine, she had a human heart.","Она — кукла, воссозданная Университетом Мисага.\n Её скелет металлический, её сердце — сердечник из серебра, её конструкция невероятно хитроумна, и даже по чертежам невозможно создать вторую такую же.\n До того как она стала холодным механизмом, у неё было человеческое сердце.","Ella es una marioneta restaurada por la universidad de mitag.\n Su esqueleto es de metal, su corazón es de plata, su estructura es extremadamente exquisita; incluso con los planos, es difícil crear un segundo igual.\nAntes de convertirse en una fría máquina, tenía un corazón humano",彼女はミサグ大学によって復元された人偶です。\n 彼女の骨組みは金属で、心臓はシルバーコアであり、その構造は非常に精妙で、設計図を見ても二つと作ることは困難です。\n そして、彼女が冷たい機械となる以前、彼女には人間の心がありました。,"그녀는 미사그 대학이 복원한 인형이다.\n뼈대는 금속으로, 심장은 은심으로 이루어져 있다. 그 구조는 매우 정교하여, 설계도를 본다고 해도 같은 것을 두 번 다시 만들기 어렵다.\n하지만 그녀가 차가운 기계가 되기 전에는, 인간의 마음을 지니고 있었다.","Elle était une poupée restaurée par l'université de Mythag.\nSon squelette était en métal, son cœur en argent, sa structure était incroyablement délicate, même face aux dessins, il était presque impossible d'en construire un autre. \nAvant de devenir une machine glacée, elle avait un cœur humain","Sie ist eine Puppe, die von der Mythag Universität wiederhergestellt wurde.\nIhr Skelett ist aus Metall, ihr Herz aus Silber, ihre Struktur ist unglaublich raffiniert; selbst im Angesicht der Entwurfspläne ist es unmöglich, ein zweites zu schaffen.\nDoch bevor sie zur kalten Maschine wurde, hatte sie ein menschliches Herz","Ela é uma boneca restaurada pela universidade de mythag.\n Sua estrutura é de metal, seu coração é de prata, sua construção é extremamente complexa, mesmo com os desenhos de projeto, é impossível criar um segundo exemplar.\nMas antes de se tornar uma máquina fria, ela possuía um coração humano",เธอเป็นตุ๊กตาที่ถูกสร้างขึ้นใหม่โดยมหาวิทยาลัยมิซากะ \n โครงกระดูกของเธอทำจากโลหะ หัวใจของเธอคือแกนเงิน โครงสร้างของเธอซับซ้อนอย่างยิ่ง แม้มีแบบแปลนการออกแบบ ก็แทบเป็นไปไม่ได้ที่จะสร้างอีกตัวหนึ่งได้ \n และก่อนที่เธอจะกลายเป็นเครื่องจักรที่ไร้ความรู้สึก เธอเคยมีหัวใจของมนุษย์,"Dia adalah boneka yang direkonstruksi oleh Universitas Mythag. \n Kerangkanya terbuat dari logam, jantungnya adalah inti perak, strukturnya sangat rumit, bahkan dengan melihat gambar desain, mustahil untuk membuat yang kedua. \n Sebelum dia menjadi mesin yang dingin, dia memiliki hati seorang manusia.","Cô ấy là một con rối được phục hồi bởi Đại học Misag. \n Bộ xương của cô ấy là kim loại, trái tim của cô ấy là bạc tâm, cấu trúc của cô ấy vô cùng tinh vi, ngay cả khi đối diện với bản vẽ thiết kế, cũng khó có thể tạo ra một cái thứ hai. \n Và trước khi trở thành một cỗ máy lạnh giá, cô ấy đã có một trái tim của con người."
StageGroup_20447_TypeText,aRfc,g关卡组_StageGroup_A.csv,152,StageGroup,TypeText,,意识潜游,Psyche Deepdive,Скиталец,El errante,意識潜航,의식 잠수,Le vagabond,Das Wandern,O errante,ผู้พเนจร,Yang berkelana,Kẻ lang thang
,,,,,,,,,,,,,,,,,,
Stage_20441_Name,aROZ,g关卡_Stage_A.csv,1697,Stage,Name,,启动测试,Start Test,Запуск теста,Iniciar prueba,起動テスト,시동 테스트,Test de démarrage,Test starten,Iniciar teste,เริ่มการทดสอบ,Mulai Tes,Bắt đầu kiểm tra
Stage_20441_Desc,aROY,g关卡_Stage_A.csv,1697,Stage,Desc,,又一个梦境，又一段过去——这一次，你看到的是拥有血肉之躯的艾瑞卡。,"Another dream, another past—this time, you see Erica with a body of flesh and blood.","Ещё одно сновидение, ещё одна часть прошлого — на этот раз вы видите Эрику из плоти и крови.","Otro sueño, otro pasado—esta vez ves a Erica con un cuerpo de carne y hueso",またの夢、またの過去――今度は、あなたが見るのは血肉を持つエリカです。,"또 다른 꿈, 또 다른 과거——이번에는 당신이 보는 것은 살아있는 몸을 가진 에리카.","Un autre rêve, un autre passé - cette fois, tu vois Erica avec un corps de chair et de sang","Ein weiterer Traum, ein weiteres vergangenes Ereignis - diesmal siehst du Erica, die einen leibhaftigen Körper hat","Outro sonho, outro passado—desta vez, você vê Erica com um corpo de carne e osso",ความฝันอีกครั้ง อดีตอีกช่วงหนึ่ง——ครั้งนี้ คุณเห็นเอริกาที่มีเนื้อและเลือด。,"Lagi-lagi sebuah mimpi, lagi-lagi masa lalu — kali ini, kau melihat Erica yang memiliki tubuh caro.","Lại một giấc mơ, lại một đoạn quá khứ —— lần này, bạn thấy Erika có thân hình bằng thịt máu."
AvgDialog_15605_Content_1,adPw,avgV1.0艾瑞卡小型支线_AvgDialog_C_M.csv,8,AvgDialog,Content,,启动测试,Start Test,Запуск теста,Iniciar prueba,起動テスト,시동 테스트,Test de démarrage,Test starten,Iniciar teste,เริ่มการทดสอบ,Mulai Tes,Bắt đầu kiểm tra
AvgDialog_15605_Content_2,adPH,avgV1.0艾瑞卡小型支线_AvgDialog_C_M.csv,9,AvgDialog,Content,爽朗的女性,齿轮咬合情况，良好；液压系统，未见压力泄漏；电机MF311000运转正常，温度偏高但在允许范围内。,"Gear engagement: good; hydraulic system: no pressure leakage; motor MF311000: running normally, temperature high but within limits.","Соединение зубчатых колес хорошее; гидравлическая система, нет признаков утечки давления; электродвигатель MF311000 работает нормально, температура немного повышенная, но в допустимых пределах.","El engranaje engrana bien; el sistema hidráulico no presenta fugas de presión; el motor MF311000 funciona normalmente, con temperatura alta pero dentro de los límites permitidos",ギアの噛み合い状況は良好です；油圧システムでは圧力漏れが見られません；モーターMF311000の運転は正常で、温度が若干高いですが許容範囲内です。,"기어 맞물림 상태, 양호; 유압 시스템, 압력 누설 없음; 모터 MF311000 작동 정상, 온도는 높지만 허용 범위 내입니다.","État d'engagement des rouages, bon ; système hydraulique, aucune fuite de pression observée ; moteur MF311000 en fonctionnement normal, température légèrement élevée mais dans la plage acceptable","Der Stand der Zahnräder ist gut; das hydraulische System zeigt keinen Druckverlust; der Motor MF311000 läuft normal, die Temperatur ist etwas hoch, liegt jedoch im zulässigen Bereich","Condição de encaixe das engrenagens, boa; sistema hidráulico, sem vazamentos de pressão; motor MF311000 operando normalmente, temperatura elevada mas dentro do limite aceitável",สภาพการสบของเกียร์ ดีเยี่ยม；ระบบไฮดรอลิก ไม่พบการรั่วไหลของความดัน；มอเตอร์ MF311000 ทำงานปกติ อุณหภูมิสูงกว่ามาตรฐานแต่อยู่ในช่วงที่ยอมรับได้,"Kondisi roda gigi terkait dengan baik; sistem hidrolik, tidak ada kebocoran tekanan; motor MF311000 beroperasi normal, suhu sedikit lebih tinggi tetapi masih dalam batas yang diizinkan.","Tình trạng răng bánh răng, tốt; hệ thống thủy lực, không phát hiện rò rỉ áp lực; động cơ MF311000 hoạt động bình thường, nhiệt độ cao hơn nhưng vẫn trong phạm vi cho phép."
AvgDialog_15605_Content_3,adPS,avgV1.0艾瑞卡小型支线_AvgDialog_C_M.csv,10,AvgDialog,Content,沉稳的女性,特殊能源S，情况稳定。,"Special Energy S, status stable.","Специальная энергия S, состояние стабильно.","Energía especial S, situación estable",特殊エネルギーS、状況は安定しています。,"특수 에너지 S, 상황 안정.","Énergie spéciale S, situation stable","Spezialenergie S, Zustand stabil","Energia Especial S, situação estável",พลังงานพิเศษ S，สถานการณ์มั่นคง。,"Energi Khusus S, kondisi stabil.","Năng lượng đặc biệt S, tình trạng ổn định."
AvgDialog_15605_Content_4,adQd,avgV1.0艾瑞卡小型支线_AvgDialog_C_M.csv,11,AvgDialog,Content,爽朗的女性,呼——准备好了吗？\n自动人偶嘀嗒人第十三次启动测试，开始。,"Whew—are you ready?\nAutomaton Tik-Tok, Test #13, commence.",#N/A,#N/A,#N/A,#N/A,#N/A,#N/A,#N/A,#N/A,#N/A,#N/A
AvgDialog_15605_Content_5,adQo,avgV1.0艾瑞卡小型支线_AvgDialog_C_M.csv,12,AvgDialog,Content,,睁开眼睛,Open your eyes,Открой глаза,Abre los ojos,目を開ける,눈을 떠,Ouvre les yeux,Augen auf,Abra os olhos,ลืมตา,Membuka mata,Mở đôi mắt
AvgDialog_15605_Content_6,adQv,avgV1.0艾瑞卡小型支线_AvgDialog_C_M.csv,13,AvgDialog,Content,爽朗的女性,嘀嗒人，你能听得到我吗？,"Tick-tock person, can you hear me?","Тик-так человек, ты можешь услышать Я?","Tic-tac, ¿puedes oírme?",ディッパーガイ、あなたは私を聞こえますか？,"디다크, 저를 들을 수 있나요?","Tic-tac, tu m'entends ?","Ticktack-Mensch, kannst du mich hören?","Tic-tac, você pode me ouvir?",ผู้ส่งเสียงติ๊กต่อก คุณได้ยินฉันไหม?,"Tik-tok, bisakah kamu mendengarku?","Tí Ta Nhân, bạn có thể nghe thấy tôi không?"
AvgDialog_15605_Content_7,adQw,avgV1.0艾瑞卡小型支线_AvgDialog_C_M.csv,14,AvgDialog,Content,,……艾瑞卡？,...Erica?,...Эрика?,……¿Érica?,……エリカ？,……에리카?,……Erica ?,……Erica?,……Erica?,...เอริกา?,...Erica?,……Erika?
AvgDialog_15605_Content_8,adQx,avgV1.0艾瑞卡小型支线_AvgDialog_C_M.csv,15,AvgDialog,Content,,熟悉的面容露出与你记忆中截然不同的自然表情，比起自动人偶，她看上去更像个活人。,"A familiar face displays a natural expression completely different from what you remember. Compared to an automaton, she appears more like a living person.","Знакомое лицо выражает эмоции, совершенно отличные от тех, что в твоей памяти. Она выглядит более живой, чем автоматическая кукла.","El rostro familiar muestra una expresión natural completamente diferente a la que recuerdas, parece más humana que una autómata",なじみの顔に、記憶とは全く異なる自然な表情が浮かんでいる。自動人形よりも、彼女は生きている人間のように見える。,"익숙한 얼굴이 당신의 기억과는 전혀 다른 자연적인 표정을 짓고 있어, 자동 인형보다는 살아있는 사람처럼 보입니다.","Un visage familier affiche une expression naturelle totalement différente de celle de tes souvenirs, elle ressemble plus à une personne vivante qu'à un automate","Ein vertrautes Gesicht zeigt einen völlig anderen Ausdruck als in deiner Erinnerung, sie sieht mehr wie ein Mensch als eine Automaton aus","O rosto familiar mostra uma expressão natural completamente diferente da que você lembra, parecendo mais humano do que um autômato",สีหน้าที่คุ้นเคยเผยออกถึงความเป็นธรรมชาติที่แตกต่างจากในความทรงจำของคุณ เธอดูเหมือนคนจริงๆ มากกว่าหุ่นยนต์อัตโนมัติ。,"Wajah yang familiar menampilkan ekspresi alami yang sangat berbeda dari memori-mu, dia terlihat lebih seperti manusia hidup dibandingkan boneka otomatis.","Gương mặt quen thuộc lộ ra biểu cảm tự nhiên hoàn toàn khác với ký ức của bạn, cô ấy trông giống một con người hơn là một con rối tự động."
AvgDialog_15605_Content_9,adQy,avgV1.0艾瑞卡小型支线_AvgDialog_C_M.csv,16,AvgDialog,Content,,……这是怎么回事？,...What is happening here?,... Что это такое?,……¿Qué está pasando?,……これはどういうことですか？,……이게 어떻게 된 거야?,……Que se passe-t-il ?,……Was ist hier los?,……O que está acontecendo?,……เกิดอะไรขึ้น?,...Apa yang sedang terjadi?,……Đây là chuyện gì vậy?
