Key,ShortKey,Source,Row,Module,Field,Character,CN,EN,RU,ES,JP,KR,FR,DE,PT,TH,IN,VI
AvgDialog_15612_Content_19,adTy,avgV1.0艾瑞卡小型支线_AvgDialog_C_M.csv,136,AvgDialog,Content,,一只巨大的手凝聚在代表了艾瑞卡精神的光球之后，指尖抽搐颤动，抖下一滴滴黑色的黏液。,"A giant hand materializes behind the orb representing Erica's spirit, its fingers twitching and dripping with black goo.","Огромная рука сформировалась позади светящегося шара, олицетворяющего дух Эрики, кончики пальцев дрожали, с них стекали капли черной жидкости.","Una enorme mano se condensó detrás de la esfera de luz que representaba el espíritu de Erica, sus dedos se contorsionaban, dejando caer gotas de un líquido negro y pegajoso",巨大な手がエリカの精神を象徴する光の球の後ろに凝縮され、指先が痙攣して震え、黒い粘液の滴が落ちた。,"거대한 손이 에리카의 정신을 상징하는 빛의 구체 뒤에 응집되어 있으며, 손가락 끝이 떨리며 검은색 점액질을 한 방울씩 흘려내렸다.","Une énorme main se forme derrière la sphère lumineuse représentant l'esprit d'Erica, ses doigts tremblant et laissant tomber des gouttes de liquide noir","Eine riesige Hand konzentriert sich hinter der Lichtkugel, die den Geist von Erica repräsentiert, die Fingerspitzen zucken und tropfen schwarzer Schleim fallen","Uma mão gigante se formou atrás da esfera de luz que representava o espírito de Erica, seus dedos tremiam, derramando gotas de líquido negro",มือขนาดใหญ่ก้อนหนึ่งก่อตัวขึ้นเบื้องหลังทรงกลมแสงที่เป็นตัวแทนของจิตใจของเอริกา ปลายนิ้วกระตุกและสั่นเทา หยดน้ำเมือกสีดำลงมา,"Sebuah tangan raksasa terbentuk di belakang bola cahaya yang mewakili Roh Erica, dengan ujung jarinya bergetar dan meneteskan tetesan lendir hitam.","Một bàn tay khổng lồ ngưng tụ phía sau quả cầu ánh sáng tượng trưng cho tinh thần của Erika, đầu ngón tay run rẩy không kiểm soát, nhỏ xuống từng giọt chất lỏng màu đen."
AvgDialog_15612_Content_20,adTA,avgV1.0艾瑞卡小型支线_AvgDialog_C_M.csv,137,AvgDialog,Content,艾瑞卡人形,……嘀嗒人……？,...Ticktockians...?,...тик-так человек...?,……¿tic-tac?,……ディッパーガイ……？,……디다크……?,……Tic-tac… ?,…Tick-Tack-Mensch…?,……Tic-tac…?,...ดิดาห์...?,...Orang Drip...?,……người tí tách……?
AvgDialog_15612_Content_21,adTB,avgV1.0艾瑞卡小型支线_AvgDialog_C_M.csv,138,AvgDialog,Content,？？？,我喜欢这个名字，没错，就叫我嘀嗒人吧。\n作为给予我新生的报答，我可以帮你救她。\n你只需要放手。,"I like this name, yes, call me the Tick-Tock Man.\nAs a token of my rebirth, I can help you save her.\nYou just need to let go.",#N/A,#N/A,#N/A,#N/A,#N/A,#N/A,#N/A,#N/A,#N/A,#N/A
AvgDialog_15612_Content_22,adTC,avgV1.0艾瑞卡小型支线_AvgDialog_C_M.csv,139,AvgDialog,Content,？？？,放手，然后，把一切都交给我。,"Let go, and leave everything to me.","Отпусти, а затем передай всё мне.",Suelta y déjalo todo en mis manos,手を離して、それから、すべてを私に任せて。,"놓으세요, 그리고, 모든 것을 저에게 맡겨 주세요.",": Lâche, et laisse-moi tout gérer",Lass los und überlass alles mir,Solte e deixe tudo comigo,ปล่อยมือ และมอบทุกอย่างให้ฉัน,"Lepaskan, lalu serahkan semuanya kepada saya.","Hãy buông tay, sau đó, giao mọi thứ cho tôi."
AvgDialog_15612_Content_23,adTD,avgV1.0艾瑞卡小型支线_AvgDialog_C_M.csv,140,AvgDialog,Content,,堆积在地上的黏液突然动了，它们彼此交融，凝成一个个扭曲的个体，蠕动着朝光的方向爬来。,"The slime piled on the ground suddenly stirred, fusing together into twisted forms that wriggled toward the light.","Слизь, скопившаяся на земле, внезапно зашевелилась. Они слились друг с другом, превратившись в искажение, и ползли, извиваясь, к источнику света.","El moco en el suelo se movió de repente, fusionándose en formas retorcidas que se arrastraban hacia la luz",地面に積もった粘液が突然動き出し、互いに融合してねじれた個体を形成し、光の方へ這い寄ってきた。,"지상에 쌓인 점액이 갑자기 움직였다. 그것들은 서로 융합되어 왜곡된 형태를 형성하고, 빛의 방향으로 기어갔다.","La boue accumulée au sol se met soudain à bouger, fusionnant pour former des entités tordues qui rampent vers la lumière","Der Schleim auf dem Boden bewegte sich plötzlich, verschmolz und bildete verzerrte Wesen, die zum Licht krochen","O lodo acumulado no chão começou a se mover, fundindo-se em formas distorcidas que rastejavam em direção à luz",เมือกที่กองอยู่บนพื้นพลันขยับ พวกมันหลอมรวมเข้าหากัน ก่อร่างเป็นตัวตนที่บิดเบี้ยวและน่าขนลุก จากนั้นค่อยๆ คลานไปทางแสงด้วยการเคลื่อนไหวช้าๆ ที่ชวนให้รู้สึกไม่สบายใจ,"Lendir yang menumpuk di tanah tiba-tiba bergerak. Mereka saling bergabung, membentuk individu-individu yang terdistorsi, lalu merayap ke arah cahaya.","Dịch chất nhầy dính đống trên mặt đất bỗng nhiên cử động, chúng hòa vào nhau, ngưng tụ thành những thể dạng biến dạng, trườn về phía ánh sáng."
,,,,,,,,,,,,,,,,,,
AvgDialog_15609_Content_1,adSe,avgV1.0艾瑞卡小型支线_AvgDialog_C_M.csv,141,AvgDialog,Content,玩家,不，艾瑞卡，不要相信它！,"No, Erica, don't believe it!","Нет, Эрика, не надо верить этому!","No, Erica, ¡no le creas!",いいえ、エリカ、それを信じないで！,"아니요, 에리카, 그걸 믿지 마세요!","Non, Erica, ne crois pas en cela !","Nein, Erica, glaube ihr nicht!","Não, Erica, não acredite nisso!",ไม่ เอริกา อย่าเชื่อมัน！,"Tidak, Erica, jangan percayai dia!","Không, Erika, đừng tin nó!"
AvgDialog_15609_Content_2,adSp,avgV1.0艾瑞卡小型支线_AvgDialog_C_M.csv,142,AvgDialog,Content,玩家,艾瑞卡，艾瑞卡！,"Erica, Erica!","Эрика, Эрика!","Erika, ¡Erika!",エリカ、エリカ！,"에리카, 에리카!","Erica, Erica !","Erica, Erica!","Erica, Erica!",เอริกา，เอริกา！,"Erica, Erica!","Erika, Erika!"
AvgDialog_15609_Content_3,adSq,avgV1.0艾瑞卡小型支线_AvgDialog_C_M.csv,143,AvgDialog,Content,,趁你对抗眼前敌人的时候，一个黏液组成的怪物绕到你身后，朝代表了艾瑞卡精神的光球扑去。,"While you fight the enemy ahead, a slime creature sneaks behind and lunges at the light representing Erica's spirit.","Пока ты сражаешься с врагом перед собой, монстр, состоящий из слизи, обходит тебя сзади и бросается к световому шару духа Эрики.","Mientras luchas contra el enemigo frente a ti, un monstruo de mucosa se mueve a tu espalda, lanzándose hacia la esfera de luz que representa el espíritu de Erica",あなたが目の前の敵と戦っている間に、スライムでできたモンスターが後ろから回り込み、エリカの精神を象徴する光球に飛びかかってきた。,"당신이 눈앞의 적과 싸우는 동안, 점액으로 이루어진 몬스터가 당신 뒤로 돌아가 에리카의 정신을 상징하는 빛의 구체를 향해 덤벼들었습니다.","Tandis que tu luttais contre l'ennemi devant toi, un monstre constitué de mucus contournait ton dos et se jetait sur la sphère lumineuse représentant l'esprit d'Erica","Während du gegen den Feind vor dir kämpfst, schleicht sich ein aus Schleim bestehendes Monster hinter dich und stürzt sich auf die Lichtkugel, die den Geist von Erica verkörpert","Enquanto você luta contra o inimigo à frente, uma criatura de lodo se aproxima por trás, atacando a esfera de luz que representa o espírito de Erica",ขณะที่เธอกำลังต่อสู้กับศัตรูตรงหน้า อมนุษย์ที่ประกอบขึ้นจากเมือกได้แอบอ้อมมาด้านหลังเธอ และพุ่งเข้าหาลูกบอลแสงที่เป็นตัวแทนของจิตใจแห่งเอริกา,"Saat kamu melawan musuh di depan, sebuah monster yang terbuat dari lendir mengitari belakangmu dan menyerang bola cahaya yang mewakili Roh Erica.","Trong khi bạn đang đối đầu với kẻ thù trước mắt, một con quái vật làm từ chất nhầy đã lẻn ra phía sau lưng bạn. Nó lao về phía quả cầu ánh sáng đại diện cho ý chí của Erika."
AvgDialog_15609_Content_4,adSr,avgV1.0艾瑞卡小型支线_AvgDialog_C_M.csv,144,AvgDialog,Content,,如入水的颜料，黑暗在光球内扩散，并覆盖了里面的一切。\n光球开始闪烁。,"Like paint dissolving in water, darkness spreads inside the light orb, covering everything within.\nThe light orb begins to flicker.",#N/A,#N/A,#N/A,#N/A,#N/A,#N/A,#N/A,#N/A,#N/A,#N/A
AvgDialog_15609_Content_5,adSs,avgV1.0艾瑞卡小型支线_AvgDialog_C_M.csv,145,AvgDialog,Content,艾瑞卡,怎么回事，我的手……自己……,What's going on? My hand... it's moving on its own...,"Что происходит, мои руки... сами..",¿Qué pasa con mi mano...? ¡Se está moviendo sola...!,どうしたんだ、私の手……勝手に……,"어떻게 된 거야, 내 손……스스로……","Que se passe-t-il, ma main... elle bouge toute seule","Was ist los, meine Hand... sie",O que está acontecendo com minha mão... sozinha,เกิดอะไรขึ้น แขนของฉัน... มันขยับเอง..,"Apa yang terjadi, tangan saya... bergerak dengan sendirinya...","Chuyện gì vậy, tay tôi……tự mình……"
AvgDialog_15609_Content_6,adSt,avgV1.0艾瑞卡小型支线_AvgDialog_C_M.csv,146,AvgDialog,Content,艾瑞卡,是不是你干的？停下，<Big:停下！>,"Was it you? Stop, <Big:Stop!>","Это ты сделал? Прекрати, <Big:Прекрати!>","¿Fuiste tú? Detente, <Big:¡Detente!>",君がやったのか？止まれ、<Big:止まれ！>,"너가 한 거야? 멈춰, <Big:멈춰!>","Est-ce toi ? Arrête, <Big:arrête !>","Warst du das? Hör auf, <Big:hör auf!>","Foi você? Pare, <Big:Pare!>",ใช่เธอทำหรือเปล่า? หยุดนะ <Big:หยุด!>,"Apa ini ulahmu? Berhenti, <Big:Berhenti!>","Có phải cậu làm không? Dừng lại, <Big:Dừng lại!>"
AvgDialog_15609_Content_7,adSu,avgV1.0艾瑞卡小型支线_AvgDialog_C_M.csv,147,AvgDialog,Content,？？？,为什么，难道你不想救她了吗？,Why? Don't you want to save her?,"Почему, разве ты не хочешь спасти её?","¿Por qué, no quieres salvarla?",なぜ、彼女を救いたくないんですか？,"왜, 그녀를 구하고 싶지 않은 거야?","Pourquoi, ne veux-tu plus la sauver ?","Warum, willst du sie nicht retten?","Por quê, você não quer mais salvá-la?",ทำไมล่ะ หรือว่าคุณไม่อยากช่วยเธอแล้ว,"Kenapa, apakah kamu tidak ingin menyelamatkannya lagi?","Tại sao, phải chăng anh không muốn cứu cô ấy nữa rồi?"
AvgDialog_15609_Content_8,adSv,avgV1.0艾瑞卡小型支线_AvgDialog_C_M.csv,148,AvgDialog,Content,艾瑞卡,你根本就是要掐死她！快松手！,You're trying to choke her to death! Let go!,Ты просто хочешь её задушить! Отпусти скорее!,¡Estás tratando de estrangularla! ¡Suéltala!,あなたは彼女を絞め殺そうとしているんです！早く手を離してください！,너는 그녀를 죽이려고 하는 거야！ 빨리 손을 놓아！,Tu veux l'étrangler ! Lâche-la !,Du wolltest sie doch erwürgen! Lass sie los!,Você quer matá-la! Solte-a agora!,เธอจะบีบคอเธอให้ตายอยู่แล้ว! ปล่อยมือเดี๋ยวนี้!,Kamu benar-benar ingin mencekiknya! Lepaskan sekarang!,"Bạn đang cố bóp chết cô ấy! Nhanh lên, buông ra!"
AvgDialog_15609_Content_9,adSw,avgV1.0艾瑞卡小型支线_AvgDialog_C_M.csv,149,AvgDialog,Content,,黑暗与光明交错间，你看到机械手一点一点伸向梅伊的颈部。,"As darkness and light intertwine, you see a mechanical hand slowly extending toward Mei's neck.","В переплетении тьмы и света ты видишь, как механическая рука одна точка за другой тянется к шее Мэй.","Entre la oscuridad y la luz, ves una mano mecánica extendiéndose hacia el cuello de Mei",ダークと光が交錯する中、あなたはメイの首に向かって少しずつロボットの手が伸びていくのを見た。,"어둠과 빛이 교차하는 사이, 당신은 메이의 목으로 기계손이 한 점씩 다가가는 것을 보았습니다.","Entre l'obscurité et la lumière, vous voyez une main mécanique s'approcher lentement du cou de Mei","Zwischen Dunkelheit und Licht siehst du, wie eine mechanische Hand langsam auf Mays Hals zusteuert","Entre a escuridão e a luz, você vê uma mão mecânica se aproximando do pescoço de Mei",ในช่วงเวลาที่ความมืดและความสว่างสลับกัน คุณเห็นแขนกลยื่นเข้าหาลำคอของเมย์ทีละนิด,"Di antara kegelapan dan cahaya yang bergantian, kamu melihat lengan mekanis perlahan-lahan merangkak menuju leher Mei.","Trong sự giao thoa giữa bóng tối và ánh sáng, bạn nhìn thấy cánh tay máy từ từ tiến tới cổ của Mei."
AvgDialog_15609_Content_10,adSf,avgV1.0艾瑞卡小型支线_AvgDialog_C_M.csv,150,AvgDialog,Content,？？？,血肉的躯体不过是灵魂的枷锁，只有让灵魂自由，她才能加入我们。\n唯有金属的身躯与心灵，才能让我们永恒。,The Caro body is merely a cage for the soul; only by freeing the soul can she join us.\nOnly metal bodies and minds grant us eternity.,#N/A,#N/A,#N/A,#N/A,#N/A,#N/A,#N/A,#N/A,#N/A,#N/A
AvgDialog_15609_Content_11,adSg,avgV1.0艾瑞卡小型支线_AvgDialog_C_M.csv,151,AvgDialog,Content,,手指收紧，梅伊脸上露出了痛苦的神色。,"Fingers tightening, Mei's face contorted in pain.","Пальцы крепко сжались, на лице Мэй появилось выражение боли.","Sus dedos se aprietan, el rostro de Mei muestra dolor",指が締まり、メイの顔に苦痛の表情が現れた。,손가락이 움츠러들어 메이의 얼굴에 고통스러운 표정이 나타났다.,"Les doigts se serrent, le visage de Mei se tord de douleur","Die Finger zogen sich zusammen, und May zeigte einen schmerzhaften Ausdruck","Os dedos se apertam, a expressão de dor aparece no rosto de Mei",นิ้วมือค่อยๆ กำแน่น ใบหน้าของเมย์เผยออกถึงความเจ็บปวด,"Jari-jarinya menegang, wajah Mei memperlihatkan ekspresi kesakitan.","Các ngón tay siết chặt, trên khuôn mặt Mei lộ rõ vẻ đau đớn."
AvgDialog_15609_Content_12,adSh,avgV1.0艾瑞卡小型支线_AvgDialog_C_M.csv,152,AvgDialog,Content,艾瑞卡,<Shake:你……疯……>,<Shake:You... insane...>,<Shake:ты...сумасшедший...>,<Shake:...estás loco...>,<Shake:あなた……狂ってる……>,<Shake:너……미쳤어……>,<Shake:Tu... es fou...>,<Shake:Du...bist verrückt...>,<Shake:Você... louco...>,<Shake:คุณ…บ้า…>,<Shake:Kamu... sinting...>,<Shake:bạn……điên……>
AvgDialog_15609_Content_13,adSi,avgV1.0艾瑞卡小型支线_AvgDialog_C_M.csv,153,AvgDialog,Content,,另一只颤抖的手出现在画面中，艾瑞卡握住自己的手腕一拧，将那只不受控制的手卸下扔到一边。,"Another trembling hand appears on the screen. Erica grabs her own wrist, twists it, and detaches the uncontrollable hand, tossing it aside.","Другая дрожащая рука появляется в кадре, Эрика сжимает свое запястье и резко поворачивает, оторвав неуправляемую руку и бросая её в сторону.","Otra mano temblorosa aparece en la pantalla, Erica agarra su muñeca y se la quita, arrojándola a un lado",別の震える手が画面に現れ、エリカは自分の手首を握って一回捻るし、制御できない手を外して脇に投げ捨てる。,"다른 떨리는 손이 화면에 나타났다. 에리카는 자신의 손목을 잡고 한 번 비틀어, 통제할 수 없는 손을 해제하여 옆으로 던졌다.","Une autre main tremblante apparaît à l'écran, Erica serre son poignet et fait un mouvement brusque pour écarter cette main incontrôlable","Ein weiteres zitterndes Hand erschien im Bild, Erica drehte ihr Handgelenk und warf die unkontrollierbare Hand zur Seite","Outra mão trêmula aparece na tela, Erica torce seu próprio pulso, removendo a mão descontrolada e jogando-a de lado",มืออีกข้างที่สั่นอยู่ปรากฏขึ้นในฉาก เอริกาจับข้อมือของตัวเองแล้วบิด ก่อนจะโยนมือที่ควบคุมไม่ได้นั้นทิ้งไป,"Sebuah tangan lain yang bergetar muncul di layar. Erica memegang pergelangan tangannya sendiri, memutarnya, lalu melepaskan tangan yang tidak terkendali itu dan melemparkannya ke samping.","Một bàn tay run rẩy khác xuất hiện trên khung hình, Erika nắm lấy cổ tay mình và vặn, gỡ bỏ bàn tay không thể kiểm soát đó và ném sang một bên."
AvgDialog_15609_Content_14,adSj,avgV1.0艾瑞卡小型支线_AvgDialog_C_M.csv,154,AvgDialog,Content,,巨手停了一瞬，像是有些不解。,"The giant hand paused for a moment, as if somewhat puzzled.","Крупная рука на мгновение остановилась, будто немного озадаченно.","La enorme mano se detuvo un momento, como si no entendiera",巨手は一瞬止まり、何か理解できないような様子だった。,"거대한 손이 잠시 멈추었고, 마치 이해하지 못하는 듯했다.","La grande main s'arrête un instant, comme perplexe","Die riesige Hand hält einen Moment inne, als wäre sie verwirrt","A mão gigante parou por um momento, como se estivesse confusa",มือยักษ์หยุดนิ่งชั่วขณะ ราวกับว่ารู้สึกสับสนเล็กน้อย,"Tangan raksasa berhenti sejenak, tampak sedikit bingung.","Bàn tay khổng lồ dừng lại một chút, như thể có chút ngạc nhiên."
AvgDialog_15609_Content_15,adSk,avgV1.0艾瑞卡小型支线_AvgDialog_C_M.csv,155,AvgDialog,Content,？？？,为什么要抵抗我呢？我是在让她获得新生啊。,Why resist me? I'm granting her a new life.,Почему ты сопротивляешься мне? Я даю ей получить новорождённый.,¿Por qué resistirme? Estoy dándole una nueva vida,なぜ私に抵抗するのですか？私は彼女に新たな新生を与えようとしているのです。,왜 나를 저항하려고 하지? 나는 그녀가 신생을 획득할 수 있게 하고 있어.,Pourquoi me résister ? Je lui donne une nouvelle vie,Warum widerstehst du mir? Ich gebe ihr ein neues Leben,Por que resistir a mim? Estou dando uma nova vida a ela,ทำไมต้องต่อต้านฉันด้วยล่ะ? ฉันกำลังให้เธอได้รับชีวิตใหม่เชียวนะ。,Kenapa melawan aku? Aku hanya ingin memberinya kehidupan baru.,Tại sao phải chống lại tôi? Tôi đang ban tặng cô ấy một sự sống mới mà.
AvgDialog_15609_Content_16,adSl,avgV1.0艾瑞卡小型支线_AvgDialog_C_M.csv,156,AvgDialog,Content,艾瑞卡,幻觉，都是，幻觉。,"It's all phantasms, phantasms.","Иллюзия, это всё, иллюзия.","Ilusiones, son, ilusiones",幻覚、全て、幻覚。,"환각, 모두, 환각.","Illusions, tout est illusion","Halluzination, alles ist Halluzination","Ilusão, tudo é ilusão",ภาพหลอน，ทั้งหมดคือ ภาพหลอน。,"Fatamorgana, semuanya adalah fatamorgana.","Ảo giác, tất cả đều là, ảo giác."
AvgDialog_15609_Content_17,adSm,avgV1.0艾瑞卡小型支线_AvgDialog_C_M.csv,157,AvgDialog,Content,,艾瑞卡扶着不省人事的梅伊缓缓站起。,Erica helped the unconscious May stand up slowly.,"Эрика, поддерживая Мэй, которая была без чувств, медленно поднялась.","Erika ayudó a Mae, que estaba inconsciente, a levantarse lentamente",エリカは意識不明のメイを支えて、ゆっくりと立ち上がった。,에리카가 의식을 잃은 메이를 부축해 천천히 함께 일어서다.,"Erica aide Mei, inconsciente, à se relever lentement",Erica stützte sich langsam auf die bewusstlose Mei und stand auf,"Erica apoiou-se em Mei, que estava inconsciente, e lentamente se levantou",เอริกาประคองม่ายที่ไม่ได้สติลุกขึ้นช้าๆ。,"Erica membantu Mei, yang tidak sadar, untuk berdiri perlahan.","Erika đỡ Mei, người đang ngất xỉu, từ từ đứng dậy."
AvgDialog_15609_Content_18,adSn,avgV1.0艾瑞卡小型支线_AvgDialog_C_M.csv,158,AvgDialog,Content,艾瑞卡,我要送她去医院，我要……让她活下去。,I'm taking her to the hospital. I... must keep her alive.,"Я отвезу её в больницу и сделаю всё, чтобы она выжила.","Voy a llevarla al hospital, debo... hacerla vivir",彼女を病院に連れて行く。私は……彼女を生き延びさせる。,"내가 그녀를 병원에 데려가야 해, 내가……그녀가 살아남도록 해야 해.","Je vais l'emmener à l'hôpital, je dois... la faire vivre","Ich bringe sie ins Krankenhaus, ich muss... sie am Leben halten","Vou levá-la ao hospital, vou... mantê-la viva",ฉันจะพาเธอไปโรงพยาบาล ฉันจะ...ทำให้เธอรอดชีวิต,"Aku akan membawanya ke rumah sakit, aku harus... membuatnya tetap hidup.","Tôi phải đưa cô ấy đến bệnh viện, tôi sẽ… giúp cô ấy sống tiếp."
AvgDialog_15609_Content_19,adSo,avgV1.0艾瑞卡小型支线_AvgDialog_C_M.csv,159,AvgDialog,Content,,她将梅伊扶起架在肩上，越过炸得七零八落的工作室，朝不远处的门走去。,"She hoisted Mei onto her shoulder and made her way through the studio, which was blown to pieces, heading toward the nearby door.","Она подняла Мэй и взвалила её на плечо, пробираясь через взорванную вдребезги мастерскую, направляясь к двери неподалёку.","Levantó a Mei y la apoyó en su hombro, cruzando el estudio destrozado, dirigiéndose hacia la puerta cercana",彼女はメイを肩に担ぎ、爆発で散乱したスタジオを越え、近くのドアへと向かって歩き出した。,그녀는 메이를 일으켜 어깨에 업고 폭발로 난장판이 된 작업실을 지나 가까운 문으로 향했다.,"Elle soutient Mei sur son épaule, traversant l'atelier en ruines, se dirigeant vers la porte proche","Sie hob May auf ihre Schulter, überquerte das zerstörte Studio und ging auf die nahegelegene Tür zu","Ela levantou Mei e a apoiou no ombro, atravessando o estúdio destruído em direção à porta próxima",เธอยกม่ายขึ้นพาดไหล่ แล้วเดินผ่านสตูดิโอที่ถูกทำลายจนเละเทะไปยังประตูที่อยู่ไม่ไกล,"Dia membantu Mei bangkit dan memapahnya di pundaknya, melewati studio yang hancur berantakan akibat ledakan, lalu berjalan menuju pintu yang tidak jauh dari sana.","Cô ấy đỡ Mei dậy, rồi vác lên vai, vượt qua xưởng làm việc bị phá hủy hoàn toàn, đi về phía cửa không xa."
,,,,,,,,,,,,,,,,,,
AvgDialog_15611_Content_1,adSZ,avgV1.0艾瑞卡小型支线_AvgDialog_C_M.csv,160,AvgDialog,Content,？？？,为什么要救她？\n她用你的梦想换前程，你真的一点都不怨恨吗？,Why save her?\nShe traded your dreams for her future. Don't you feel any resentment?,#N/A,#N/A,#N/A,#N/A,#N/A,#N/A,#N/A,#N/A,#N/A,#N/A
