Key,ShortKey,Source,Row,Module,Field,Character,CN,EN,RU,ES,JP,KR,FR,DE,PT,TH,IN,VI
AvgDialog_15606_Content_3,adQV,avgV1.0艾瑞卡小型支线_AvgDialog_C_M.csv,65,AvgDialog,Content,,从恒久的黑暗中苏醒，你发现自己还在工作室里，烧黑的电机仍旧摆在工作台上，用数条粗细不一的线缆与你的躯体相连。,"Awakening from the eternal darkness, you find yourself still in the workshop. The charred motor remains on the workbench, connected to your Body by several cables of varying thickness.","Проснувшись из вечного тёмного, вы обнаруживаете себя в своей мастерской. Обугленный двигатель всё ещё стоит на рабочем столе, подключенный к вашему телу несколькими кабелями разной толщины.","Despertando de la oscuridad eterna, te encuentras aún en el estudio, con el motor quemado en la mesa de trabajo, conectado a tu cuerpo por varios cables de diferentes grosores",永遠のダークから目覚め、あなたはまだスタジオにいると発見します。焼け焦げたモーターがまだ作業台上に置かれており、数本の太さが異なるケーブルであなたのからだとつながっています。,"영원한 어둠에서 각성하여, 당신은 자신이 여전히 작업실에 있다는 것을 발견했습니다. 타버린 모터가 여전히 작업대 위에 놓여 있으며, 굵기 다른 케이블로 당신의 육체와 연결되어 있습니다.","Réveillé d'une obscurité éternelle, tu te trouves encore dans l'atelier, avec le moteur brûlé toujours sur la table de travail, relié à ton corps par plusieurs câbles de différentes tailles","Aus der ewigen Dunkelheit erwachend, findest du dich noch im Studio, der verbrannte Motor liegt auf dem Arbeitstisch, mit mehreren Kabeln an deinen Körper angeschlossen","Despertando da escuridão eterna, você se encontra ainda no estúdio, com o motor queimado na bancada, conectado ao seu corpo por vários cabos",จากความมืดมิดอันยาวนาน คุณตื่นขึ้นมาและพบว่าตัวเองยังคงอยู่ในสตูดิโอ มอเตอร์ที่ไหม้เกรียมยังคงวางอยู่บนโต๊ะทำงาน เชื่อมต่อกับร่างกายของคุณด้วยสายเคเบิลหลายขนาด,"Terbangun dari kegelapan yang abadi, kamu menyadari bahwa dirimu masih berada di dalam studio. Motor yang terbakar sampai menghitam masih tergeletak di atas meja kerja, terhubung ke Tubuhmu dengan beberapa kabel berbagai ketebalan.","Tỉnh dậy từ bóng tối vĩnh cửu, bạn phát hiện mình vẫn còn trong xưởng làm việc, mô tơ bị cháy đen vẫn nằm trên bàn làm việc, nối với thân thể bạn bằng nhiều sợi cáp có đường kính khác nhau."
AvgDialog_15606_Content_4,adRg,avgV1.0艾瑞卡小型支线_AvgDialog_C_M.csv,66,AvgDialog,Content,,能听见。,Can be heard.,Слышу.,Puedo oír,聞こえます。,들을 수 있어요.,Je peux entendre,Ich höre dich,Posso ouvir,ได้ยิน。,Dapat mendengar.,Có thể nghe thấy.
AvgDialog_15606_Content_5,adRr,avgV1.0艾瑞卡小型支线_AvgDialog_C_M.csv,67,AvgDialog,Content,艾瑞卡人形,抱歉啊，我保证接下来就专门攻克发声模块！这阵子你先忍一下，好吗？,"Sorry, I promise to focus on tackling the voice module next! Please bear with it for now, okay?","Извини, я обещаю, что скоро займусь модулем звука! Пожалуйста, потерпи немного, хорошо?","Lo siento, prometo que pronto arreglaré el módulo de voz. Por ahora, ¿puedes aguantar un poco?",すみません、これから発声モジュールに集中して改善することをお約束します！しばらくの間、我慢していただけますか？,"죄송해요, 앞으로는 발성 모듈에 집중할게요! 이번 주만 참아줄래요?",": Désolé, je te promets de me concentrer sur le module vocal ! Pour l'instant, supporte un peu, d'accord ?","Entschuldigung, ich verspreche, dass ich mich als nächstes auf das Sprachmodul konzentrieren werde! Bitte halte es noch eine Weile aus, okay?","Desculpe, prometo que vou focar no módulo de voz! Aguente um pouco mais, por favor?",ขอโทษนะ ฉันสัญญาว่าจะมุ่งเน้นไปที่โมดูลการออกเสียงต่อจากนี้! ช่วงนี้ช่วยทนกับฉันหน่อยนะ,"Maaf ya, aku berjanji akan fokus memperbaiki modul suara selanjutnya! Sementara ini, bisakah kamu bersabar dulu, baik?","Xin lỗi, tôi đảm bảo sẽ tập trung vào việc cải thiện mô-đun phát âm ngay! Bạn cố gắng chịu đựng một chút nhé!"
AvgDialog_15606_Content_6,adRv,avgV1.0艾瑞卡小型支线_AvgDialog_C_M.csv,68,AvgDialog,Content,,点头。,Nod.,Кивок.,Asentir,うなずく。,고개를 끄덕이다.,Hochement de tête,Nicken,Acenar,พยักหน้า。,Mengangguk.,Gật đầu.
AvgDialog_15606_Content_7,adRw,avgV1.0艾瑞卡小型支线_AvgDialog_C_M.csv,69,AvgDialog,Content,艾瑞卡人形,父神保佑，太好了。我真怕哪条线被烧坏了。,"Thank the Father God, that's great. I was really worried a wire might have burned out.","Слава Отцу, отлично. Боялся, что проводка сгорела.","Gracias al Padre Dios, qué alivio. Temía que algún cable se hubiera quemado",父神様、ありがとうございます。良かった。線が焼けてしまうのが心配でした。,"부신님의 보호, 정말 다행입니다. 전선이 타버리는 게 무서웠어요.","Dieu le Père soit loué, c'est une bonne nouvelle. J'avais peur qu'un fil soit brûlé","Gott sei Dank, das ist gut. Ich hatte Angst, dass ein Kabel durchgebrannt ist","Graças ao Pai Deus, que bom. Eu estava com medo de que algum fio tivesse queimado",พระบิดาคุ้มครอง โชคดีจริงๆ ฉันกลัวว่าสายไฟเส้นไหนจะไหม้ไปซะก่อน,"Ayah surgawi melindungi, syukurlah. Aku benar-benar takut salah satu kabelnya terbakar.","Thần cha phù hộ, thật tốt quá. Tôi thực sự sợ rằng một đường dây nào đó bị cháy hỏng."
AvgDialog_15606_Content_8,adRx,avgV1.0艾瑞卡小型支线_AvgDialog_C_M.csv,70,AvgDialog,Content,,她松了口气，像是才感受到疲惫一样大大地打了个呵欠。,"She let out a sigh of relief, then yawned widely as if only now feeling tired.","Она облегчённо вздохнула и широко зевнула, словно только сейчас почувствовала усталость.","Ella suspiró de alivio, como si recién sintiera el cansancio, y bostezó profundamente",彼女は安堵の息をつき、まるで疲れに気づいたかのように大きくあくびをしたように見えた。,그녀는 마치 피곤함을 이제야 느끼는 것처럼 크게 하품을 하며 안도의 한숨을 내쉬었다.,"Elle a soupiré de soulagement, bâillant largement comme si elle ressentait enfin la fatigue","Sie atmete erleichtert auf und gähnte groß, als ob sie erst jetzt die Müdigkeit spürte","Ela suspirou de alívio, como se só agora sentisse o cansaço, e deu um grande bocejo",เธอถอนหายใจอย่างโล่งอก ราวกับเพิ่งรู้สึกเหนื่อยล้าแล้วหาวใหญ่,"Dia menghela napas lega, seolah baru merasakan kelelahan dan langsung menguap lebar.","Cô thở phào nhẹ nhõm, dường như chỉ vừa nhận ra cơn mệt mỏi và ngáp một cái thật to."
AvgDialog_15606_Content_9,adRy,avgV1.0艾瑞卡小型支线_AvgDialog_C_M.csv,71,AvgDialog,Content,艾瑞卡人形,我得去喝一杯咖啡，还有晚餐……,I need to grab a coffee and have dinner...,"Мне нужно выпить чашку кофе, и поужинать..",Necesito un café y una cena,コーヒーを一杯飲んで、そして、ディナー……,나는 커피 한 잔을 마셔야 하고 저녁 식사도 해야 해……,"Je dois aller boire un café, et dîner","Ich muss mir eine Tasse Kaffee holen, und Abendessen",Preciso tomar um café e jantar,ฉันต้องไปดื่มกาแฟสักแก้ว แล้วก็ทานมื้อเย็น..,Saya harus pergi minum secangkir kopi dan makan malam…,"Tôi cần đi uống một cốc cà phê, còn bữa tối…"
AvgDialog_15606_Content_10,adQA,avgV1.0艾瑞卡小型支线_AvgDialog_C_M.csv,72,AvgDialog,Content,,她嘟囔着离开了，留下你，和工作台上的电机与零件。,"She muttered as she left, leaving you with the motor and parts on the workbench.","Она бурча покинула, оставив тебя и мотор с деталями на рабочем столе.","Ella murmuró y se fue, dejándote con el motor y las piezas en la mesa de trabajo",彼女はぶつぶつ言いながら離れ、あなたを残し、作業台のモーターと部品もそのままにした。,"그녀는 불평하며 떠났고, 당신과 작업대 위의 모터와 부품을 남겨두었습니다.","Elle marmonna en partant, te laissant avec le moteur et les pièces sur l'établi","Sie murmelte und ging, ließ dich zurück mit dem Motor und den Teilen auf der Werkbank","Ela resmungou e saiu, deixando você com o motor e as peças na bancada",เธอบ่นพึมพำขณะเดินจากไป ปล่อยให้คุณอยู่กับเครื่องยนต์ไฟฟ้าและชิ้นส่วนบนโต๊ะทำงาน,"Dia bergumam saat pergi, meninggalkanmu dengan motor dan komponen di atas meja kerja.","Cô ấy lẩm bẩm rời đi, để lại bạn, và động cơ cùng các linh kiện trên bàn làm việc ."
AvgDialog_15606_Content_11,adQB,avgV1.0艾瑞卡小型支线_AvgDialog_C_M.csv,73,AvgDialog,Content,,你看向自己的手。,You look at your hand.,Ты смотришь на свою руку.,Miras tus manos,自分の手を見る。,당신은 자신의 손을 바라봅니다.,Tu regardes ta main,Du schaust auf deine Hand,Você olha para sua mão,คุณมองไปที่มือของตัวเอง ,Kamu menatap tanganmu sendiri.,Bạn đưa mắt xuống bàn tay mình.
AvgDialog_15606_Content_12,adQC,avgV1.0艾瑞卡小型支线_AvgDialog_C_M.csv,74,AvgDialog,Content,,纤细，有力，细腻的瓷制外壳被仔细擦拭维护过，尽管冰冷，在昏暗的灯光下看上去与活人无异。,"Slender, strong, and delicately crafted porcelain shell, carefully polished and maintained. Despite its coldness, it looks lifelike under dim light.","Тонкая, сильная, нежная керамическая оболочка была тщательно протёрта и сохранена в идеальном состоянии. Несмотря на холод, при тусклом свете она выглядела как живая.","Delgado, fuerte, la delicada carcasa de porcelana ha sido cuidadosamente pulida y mantenida, aunque fría, parece casi viva bajo la tenue luz",細身で力強く、繊細な磁器製の外殻は丁寧に磨かれ、手入れが施されています。冷たくても、暗いライトの下では生身の人間と区別がつきません。,"세밀하고 강하며 섬세한 도자기 외피는 정성스럽게 닦아 유지되었으며, 차가운데 어두운 조명 아래에서는 살아있는 사람과 다를 바 없어 보인다.","Une coque en porcelaine délicate, puissante et soignée, bien qu'elle soit froide, paraît comme celle d'un vivant sous la faible lumière","Dünn, kraftvoll, feine Keramikschale, sorgfältig gewartet, sieht im schwachen Licht trotz ihrer Kälte aus wie ein Lebender","A delicada e resistente concha de porcelana foi cuidadosamente limpa e, embora fria, sob a luz esfumaçada parece indistinguível de uma pessoa viva",บางเบา แข็งแรง เปลือกเซรามิกที่ละเอียดอ่อนได้รับการเช็ดและบำรุงรักษาอย่างพิถีพิถัน แม้จะเย็นเฉียบ แต่ภายใต้แสงสลัวกลับดูไม่แตกต่างจากคนเป็น,"Ramping, kuat, dan halus, cangkang keramiknya telah dibersihkan dan dirawat dengan hati-hati. Meskipun dingin, di bawah cahaya redup tampak seperti manusia hidup.","Mảnh mai, mạnh mẽ, mịn màng và tinh xảo, vỏ sứ được chăm sóc kỹ lưỡng, mặc dù lạnh lẽo, dưới ánh đèn mờ tối trông không khác gì một người thực sự sống động."
AvgDialog_15606_Content_13,adQD,avgV1.0艾瑞卡小型支线_AvgDialog_C_M.csv,75,AvgDialog,Content,,这是艾瑞卡的手，你认识的那个<Blue:自动人偶艾瑞卡>的手。\n你似乎占据了她后来的身体，成为了她制造的那个自动人偶。,"This is Erica's hand, the hand of the <Blue:Automaton Erica> you know.\nYou seem to inhabit her later body, becoming the automaton she created.",#N/A,#N/A,#N/A,#N/A,#N/A,#N/A,#N/A,#N/A,#N/A,#N/A
AvgDialog_15606_Content_14,adQE,avgV1.0艾瑞卡小型支线_AvgDialog_C_M.csv,76,AvgDialog,Content,,刚才你看到的她分明是个人类。\n到底是什么经历，才把她变成后来那副模样？,The person you saw just now was clearly human.\nWhat kind of experience could have transformed her into what she has become?,#N/A,#N/A,#N/A,#N/A,#N/A,#N/A,#N/A,#N/A,#N/A,#N/A
AvgDialog_15606_Content_15,adQF,avgV1.0艾瑞卡小型支线_AvgDialog_C_M.csv,77,AvgDialog,Content,梅伊,艾瑞卡？,Erica?,Эрика?,¿Erika?,エリカ？,에리카?,Erica ?,Erica?,Erica?,เอริกา?,Erica?,Erika?
AvgDialog_15606_Content_16,adQG,avgV1.0艾瑞卡小型支线_AvgDialog_C_M.csv,78,AvgDialog,Content,,你眨眨眼，梅伊不知何时进来了。\n她的视线在房间内转了一圈，最终落在你身旁的电机上。,"You blink, and Mei has somehow entered.\nHer gaze sweeps across the room and finally settles on the motor next to you.",#N/A,#N/A,#N/A,#N/A,#N/A,#N/A,#N/A,#N/A,#N/A,#N/A
AvgDialog_15606_Content_17,adQH,avgV1.0艾瑞卡小型支线_AvgDialog_C_M.csv,79,AvgDialog,Content,梅伊,……,...,#N/A,#N/A,#N/A,#N/A,#N/A,#N/A,#N/A,#N/A,#N/A,#N/A
AvgDialog_15606_Content_18,adQI,avgV1.0艾瑞卡小型支线_AvgDialog_C_M.csv,80,AvgDialog,Content,,第二次扫视了一圈房间后，她掩上门，快步朝电机走来。,"After scanning the room a second time, she shut the door and hurried toward the generator.",После второго осмотра комнаты она прикрыла дверь и быстро направилась к двигателю.,"Después de echar un segundo vistazo a la habitación, cerró la puerta y se dirigió rápidamente hacia el motor",部屋を二度見回した後、彼女はドアを閉め、素早くモーターに向かって歩み寄る。,"방을 두 번째로 둘러본 후, 그녀는 문을 조심스럽게 닫고 모터 쪽으로 빠르게 걸어갔다.",": Après un deuxième coup d'œil dans la pièce, elle ferme la porte et se dirige rapidement vers le générateur",Nach einem zweiten Blick in den Raum schloss sie die Tür und ging schnell zum Generator,"Depois de olhar o quarto pela segunda vez, ela fechou a porta e caminhou rapidamente em direção ao motor",หลังจากเหลือบมองรอบห้องเป็นครั้งที่สอง เธอก็ปิดประตูแล้วเดินเร็วๆ ไปทางมอเตอร์ไฟฟ้า,"Setelah memandang sekilas ruangan untuk kedua kalinya, dia menutup pintu dan dengan cepat melangkah menuju motor.","Sau khi quét mắt một vòng phòng lần nữa, cô đóng cửa lại và bước nhanh đến máy phát điện."
AvgDialog_15606_Content_19,adQJ,avgV1.0艾瑞卡小型支线_AvgDialog_C_M.csv,81,AvgDialog,Content,梅伊,对不起，艾瑞卡。,"Sorry, Erica.","Извините, Эрика.","Lo siento, Erica",すみません、エリカ。,"죄송합니다, 에리카.","Désolé, Erica","Entschuldigung, Erica","Desculpa, Erica",ขอโทษนะ เอริกา。,"Maaf, Erica.","Xin lỗi, Erika."
AvgDialog_15606_Content_20,adQL,avgV1.0艾瑞卡小型支线_AvgDialog_C_M.csv,82,AvgDialog,Content,,盖子拧动，梅伊捏住了里面的东西。这次你看清了，那是一个直径不过5厘米，侧面刻着字母“S”的金属圆筒。,"The lid twisted open, and Mei pinched the item inside. This time, you saw it clearly: a metal cylinder no more than 5 cm in diameter, with the letter ""S"" engraved on its side.","Крышка повернулась, Мэй сжала то, что было внутри. На этот раз ты разглядел, что это металлический цилиндр диаметром не более 5 сантиметров, с гравировкой буквы 《S》.","Giró la tapa, y May apretó lo que había dentro. Esta vez lo viste claramente, era un cilindro metálico de unos 5 cm de diámetro, con la letra ""S"" grabada en el lateral",蓋を回し、メイは中に手を入れて何かをつまんだ。今回ははっきりと見えた。それは直径5センチメートル程度で、側面に「S」という文字が刻まれた金属の円筒だった。,"뚜껑이 돌려졌고, 메이는 안의 것을 잡았다. 이번에는 당신이 보았습니다. 그것은 지름이 5센티미터를 넘지 않고, 측면에 ""S""라는 글자가 새겨진 금속 원통이었습니다.","Le couvercle tourne, Mei saisit l'objet à l'intérieur. Cette fois, tu l'as vu clairement, c'est un cylindre métallique de 5 cm de diamètre, avec la lettre ""S"" gravée sur le côté","Der Deckel drehte sich, und May hielt das Ding darin fest. Diesmal hast du es klar gesehen, es war ein Metallzylinder mit einem Durchmesser von nur 5 cm, mit dem Buchstaben ""S"" an der Seite","A tampa girou, e May segurou o objeto dentro. Desta vez você viu claramente, era um cilindro de metal com cerca de 5 cm de diâmetro, com a letra ""S"" gravada na lateral","ฝาถูกหมุนออก เมย์หยิบสิ่งที่อยู่ข้างในได้ ครั้งนี้คุณเห็นชัดเจนแล้ว มันคือกระบอกโลหะที่มีเส้นผ่านศูนย์กลางไม่เกิน 5 เซนติเมตร และด้านข้างแกะสลักตัวอักษร ""S""","Tutup diputar, Mei mencengkeram benda di dalamnya. Kali ini kamu bisa melihat dengan jelas, itu adalah tabung logam dengan diameter tidak lebih dari 5 sentimeter, dengan huruf ""S"" terukir di sisinya.","Nắp vặn mở, Mei nắm lấy vật bên trong. Lần này bạn nhìn rõ, đó là một ống kim loại có đường kính không quá 5 cm (centimet), mặt bên được khắc chữ cái ""S""."
AvgDialog_15606_Content_21,adQM,avgV1.0艾瑞卡小型支线_AvgDialog_C_M.csv,83,AvgDialog,Content,,一旦她将圆筒完全抽出，你就会再次失去意识。\n所以在那之前，你必须——,"Once she fully withdraws the cylinder, you will lose consciousness again.\nSo before that, you must—",#N/A,#N/A,#N/A,#N/A,#N/A,#N/A,#N/A,#N/A,#N/A,#N/A
AvgDialog_15606_Content_22,adQN,avgV1.0艾瑞卡小型支线_AvgDialog_C_M.csv,84,AvgDialog,Content,,抓住她的手,Grab her hand,Схвати её за руку,Toma su mano,彼女の手をつかむ,그녀의 손을 잡아,Attrape sa main,Fass ihre Hand,Segure a mão dela,เอื้อมมือไปจับมือเธอ,Pegang tangannya,Nắm chặt tay cô ấy
AvgDialog_15606_Content_23,adQO,avgV1.0艾瑞卡小型支线_AvgDialog_C_M.csv,85,AvgDialog,Content,梅伊,啊！,Ah!,Ах!,¡Ah!,あ！,아!,Ah !,Ah!,Ah!,อ้า!,Ah!,À!
AvgDialog_15606_Content_24,adQP,avgV1.0艾瑞卡小型支线_AvgDialog_C_M.csv,86,AvgDialog,Content,艾瑞卡人形,怎么了怎么了——,What's going on—,Что случилось? что такое?—— ,"¿Qué pasa, qué pasa?",どうしたのどうしたの――,어떻게 된 거야? 어떻게 된 거야——,Qu'est-ce qui se passe—,"Was ist los, was ist los—","O que houve, o que houve—",มีอะไร มีอะไร——,Apa? Apa? ——,Sao rồi sao rồi—— 
AvgDialog_15606_Content_25,adQQ,avgV1.0艾瑞卡小型支线_AvgDialog_C_M.csv,87,AvgDialog,Content,,艾瑞卡撞进房间，脸上的关切在看到梅伊手里的圆筒后瞬间凝固。,"Erica rushed into the room, her concern freezing the moment she saw the cylinder in Mei's hand.","Эрика ворвалась в комнату, волнение на её лице мгновенно застыло, когда она увидела цилиндр в руках Мэй.","Erika irrumpió en la habitación, la preocupación en su rostro se congeló al ver el cilindro en manos de Mae",エリカが部屋に突入し、メイが持っている円筒を見て、顔に浮かんでいた心配が瞬時に凍りついた。,"에리카가 방으로 뛰어들어와, 메이가 손에 든 원통을 보고 얼굴에 드리운 걱정이 순간적으로 굳어졌다.","Erica se précipite dans la pièce, l'inquiétude sur son visage se fige en voyant le cylindre dans la main de Mei","Erica stürmte in den Raum, und die Besorgnis auf ihrem Gesicht erstarrte sofort, als sie die Röhre in Meis Hand sah","Erica irrompeu na sala, sua expressão preocupada congelou instantaneamente ao ver o cilindro nas mãos de Mei",เอริกาพุ่งเข้ามาในห้อง แต่เมื่อเห็นหลอดทรงกระบอกในมือของเมย์ ความกังวลบนใบหน้าของเธอก็แข็งตัวทันที,"Erica menabrak masuk ke dalam ruangan, kekhawatirannya langsung membeku saat melihat tabung di tangan Mei.","Erika xông vào phòng, sự lo lắng trên gương mặt cô chợt hóa đá khi nhìn thấy ống tròn trong tay Mei."
AvgDialog_15606_Content_26,adQR,avgV1.0艾瑞卡小型支线_AvgDialog_C_M.csv,88,AvgDialog,Content,艾瑞卡人形,梅伊，你这是在干什么？,"Mei, what are you doing?","Мэй, что ты делаешь?","Mei Yi, ¿qué estás haciendo?",メイ、何をしているの？,"메이, 네가 뭘 하고 있어?","Mei Yi, que fais-tu ?","Mei Yi, was machst du da?","Mei, o que você está fazendo?","เมย์, นี่เธอกำลังทำอะไรอยู่นะ?","Mei, apa yang sedang kamu lakukan?","Mai, bạn đang làm gì vậy?"
AvgDialog_15606_Content_27,adQS,avgV1.0艾瑞卡小型支线_AvgDialog_C_M.csv,89,AvgDialog,Content,艾瑞卡人形,你在干什么！,What are you doing!,Что ты делаешь!,¡¿Qué estás haciendo?!,何してるの！,너는 무엇을 하고 있어!,Que fais-tu !,Was machst du da!,O que você está fazendo!,คุณกำลังทำอะไรอยู่！,Apa yang sedang kamu lakukan!,Bạn đang làm gì!
AvgDialog_15606_Content_28,adQT,avgV1.0艾瑞卡小型支线_AvgDialog_C_M.csv,90,AvgDialog,Content,梅伊,我只是在尝试……这个能源……竟然真的可以……,I'm just trying... this energy... it really works...,Я просто пробую... этот энергетический источник... он действительно работает..,Solo estoy probando... esta energía... realmente puede,私はただ試していただけ……このエネルギー……本当に使えるとは……,나는 단지 시도하고 있었을 뿐…… 이 에너지는…… 정말로 가능하다……,Je fais juste un essai... cette énergie... ça marche vraiment,Ich versuche nur... diese Energie... es funktioniert wirklich,Só estou tentando... essa energia... realmente funciona,ฉันแค่ลอง... พลังงานนี้... จริงๆ แล้วมันใช้ได้..,Aku hanya mencoba... energi ini... ternyata benar-benar bisa...,Tôi chỉ đang thử... nguồn năng lượng này... lại thực sự có thể..
