Key,ShortKey,Source,Row,Module,Field,Character,CN,EN,RU,ES,JP,KR,FR,DE,PT,TH,IN,VI
AvgDialog_15610_Content_28,adSR,avgV1.0艾瑞卡小型支线_AvgDialog_C_M.csv,202,AvgDialog,Content,？？？,再见，我短暂的造物主。,"Goodbye, my fleeting creator.","До свидания, мое кратковременное создание.","Adiós, mi breve creador",さようなら、短いつくりもの。,"안녕히 계세요, 나의 짧게 존재한 조물주.","Adieu, mon créateur éphémère","Leb wohl, mein kurzlebiger Schöpfer","Adeus, meu breve criador",ลาก่อน ข้าผู้สร้างสิ่งสร้างชั่วคราวของข้า,"Selamat tinggal, Penciptaku yang singkat.","Tạm biệt, tạo vật ngắn ngủi của tôi."
,,,,,,,,,,,,,,,,,,
AvgDialog_15607_Content_1,adRz,avgV1.0艾瑞卡小型支线_AvgDialog_C_M.csv,203,AvgDialog,Content,,电浆炮射向巨手，银芯在冲击下剥离掌心，无声地掉落到地上。,"The plasma cannon struck the giant hand, causing Silver to peel off the palm and fall silently to the ground.","Плазменная пушка стреляет в гигантскую руку, сердечник из серебра отделяется от ладони под ударом и беззвучно дропается на землю.","El cañón de plasma disparó a la mano gigante, el núcleo plateado se desprendió y cayó al suelo en silencio",電漿砲が巨手に向かって放たれ、シルバーコアがインパクトで掌から剥がれ、音もなく地上にドロップした。,전기 플라즈마 포가 거대한 손을 향해 발사되었다. 은심은 충격으로 인해 손바닥에서 떨어져 나와 소리 없이 땅에 떨어졌다.,"Le canon à plasma frappe la main géante, le noyau d'argent séparé tombe silencieusement au sol","Der Plasmakanone traf die riesige Hand, der Silberkern löste sich bei der Kollision von der Handfläche und fiel lautlos zu Boden","O canhão de plasma dispara na mão gigante, o núcleo de prata se desprende silenciosamente da palma e cai ao chão",ปืนพลาสมาพุ่งเข้าใส่มือยักษ์ เงินใจหลุดออกจากฝ่ามือโดยแรงกระแทก ตกลงพื้นเงียบๆ,"Meriam plasma menembak ke arah tangan raksasa, Perak terlepas dari telapak tangan akibat benturan, dan jatuh ke tanah tanpa suara.","Súng plasma bắn vào tay khổng lồ mech, bạc tâm bị tách ra khỏi lòng bàn tay và rơi xuống đất trong im lặng."
AvgDialog_15607_Content_2,adRK,avgV1.0艾瑞卡小型支线_AvgDialog_C_M.csv,204,AvgDialog,Content,,片刻的停滞后，巨手溃散瓦解，黑色黏液如大雨一般倾泻而下，它穿过了你，却染黑了艾瑞卡的虚影。,"After a moment of stillness, the giant hand disintegrated, and black slime poured down like heavy rain. It passed through you but stained Erica's phantom.","После короткой задержки гигантская рука рассыпалась на части, а черная слизь хлынула вниз подобно потоку дождя. Она прошла сквозь тебя, но оставила черное пятно на призрачном облике Эрики.","Después de un breve momento de estancamiento, la gran mano se desmoronó y la sustancia negra se precipitó como una fuerte lluvia, atravesándote y manchando de negro la sombra de Erica",一瞬の遅滞の後、巨手が崩れ瓦解し、黒い粘液が大雨のように降り注いだ。それはあなたを貫いたが、エリカの虚影を染めた。,"잠시의 정지 후, 거대한 손이 해체되어 검은색 점액이 비처럼 쏟아져 내렸다. 그것은 당신을 통과했지만, 에리카의 환영을 검게 물들였습니다.","Après un instant de pause, la grande main se désintégra, une pluie de liquide noir tomba, traversant ton corps mais teintant l'ombre d'Erica","Nach einem kurzen Stillstand zerbrach die riesige Hand und die schwarze Schleimflüssigkeit strömte wie Regen herab, durchdrang dich, färbte jedoch Ericas Phantasie schwarz","Após uma breve pausa, a mão gigante se desfez, e o líquido negro caiu como chuva, passando por você e manchando a sombra de Erica",หลังจากหยุดชะงักชั่วขณะ มือยักษ์ก็พังทลายและสลายตัว น้ำกาวสีดำไหลลงมาเหมือนฝนตกหนัก มันทะลุผ่านตัวคุณไป แต่กลับทำให้เงาร่างของเอริกาเปลี่ยนเป็นสีดำ。,"Setelah jeda sesaat, tangan raksasa itu hancur berantakan, cairan hitamnya mengucur deras seperti hujan lebat. Cairan itu menembus tubuhmu, namun mewarnai bayangan semu Erica menjadi hitam.","Sau một khoảnh khắc trì hoãn, bàn tay khổng lồ tan rã, chất lỏng đen như mưa lớn tuôn rơi, nó xuyên qua bạn nhưng đã làm tối đi hình bóng của Erika."
AvgDialog_15607_Content_3,adRU,avgV1.0艾瑞卡小型支线_AvgDialog_C_M.csv,205,AvgDialog,Content,艾瑞卡,结束……了……,It's... over...,Конец..,Fin... terminado,終わりました……,끝났습니다…,C'est... fini,Es ist... vorbei,Acabou... acabou,จบ...แล้ว..,Selesai... sudah...,Kết thúc… rồi…
AvgDialog_15607_Content_4,adRV,avgV1.0艾瑞卡小型支线_AvgDialog_C_M.csv,206,AvgDialog,Content,？？？,你真的这样认为吗？,Do you really think so?,Вы действительно так считаете?,¿Realmente piensas eso?,本当にそう思うの？,정말 그렇게 생각하세요?,Tu le penses vraiment ?,Glaubst du das wirklich?,Você realmente pensa assim?,คุณคิดอย่างนั้นจริงๆ หรือ?,Apakah kamu benar-benar berpikir seperti itu?,Bạn thực sự nghĩ như vậy sao?
AvgDialog_15607_Content_5,adRW,avgV1.0艾瑞卡小型支线_AvgDialog_C_M.csv,207,AvgDialog,Content,艾瑞卡,！？,!?,#N/A,#N/A,#N/A,#N/A,#N/A,#N/A,#N/A,#N/A,#N/A,#N/A
AvgDialog_15607_Content_6,adRX,avgV1.0艾瑞卡小型支线_AvgDialog_C_M.csv,208,AvgDialog,Content,？？？,我说过了，只要进入这银色的心脏就能迎来真正的不朽。,"I told you, just enter this silver heart to attain true immortality.","Я уже говорил, что стоит войти в это серебряное сердце, и можно будет обрести истинное бессмертие.","Dije que al entrar en este corazón plateado, alcanzaríamos la verdadera inmortalidad",私は言ったのです、この銀色の心臓に入れば、真の不朽を得ることができる。,"나는 이미 말했지만, 이 은색의 심장에 들어가기만 하면 진정한 불멸을 맞이할 수 있다.","Je l'ai dit, entrer dans ce cœur d'argent apporte l'immortalité véritable","Ich sagte, sobald wir das silberne Herz betreten, erreichen wir wahre Unsterblichkeit","Eu disse, ao entrar no coração prateado, alcançaremos a verdadeira imortalidade",ฉันบอกแล้วว่า แค่เข้ามาในจิตใจแห่งสีเงินนี้ ก็จะได้พบกับความเป็นอมตะที่แท้จริง,"Sudah kubilang, jika kita bisa masuk ke dalam jantung perak ini, keabadian sejati akan segera menyambut kita.","Tôi đã nói rồi, chỉ cần bước vào trái tim màu bạc huyền bí này là có thể đón nhận sự bất tử thực sự."
AvgDialog_15607_Content_7,adRY,avgV1.0艾瑞卡小型支线_AvgDialog_C_M.csv,209,AvgDialog,Content,？？？,尽可能挣扎吧，黑色物质终会将你抹去，到时我就能给世界带来真正的<Red:「蜕变」>——人人得以不朽，人人得以永生。,"Struggle as you might, the black matter will eventually erase you, and then I will bring true <Red:""Metamorphosis""> to the world—immortality for all, eternal life for everyone.","Попытайся сопротивляться, черная материя в конце концов сотрёт тебя, тогда я смогу принести миру истинную <Red:《метаморфозу》> — все станут бессмертными, все обретут вечную жизнь.","Lucha todo lo que puedas, la materia negra te borrará y entonces traeré la verdadera <Red:「Transformación」> al mundo: inmortalidad para todos",できる限り抵抗しなさい。黒い物質は最終的にあなたを消し去るだろう。その時、私は世界に真の<Red:「変革」>をもたらすことができる――誰もが不死となり、永遠の命を得る。,"가능한 한 투쟁해 보세요. 검은 물질은 결국 당신을 지우고, 그때 내가 세상에 진정한<Red:“변화”>를 가져올 것입니다—— 모든 사람이 불멸하고, 모든 사람이 영원히 살 수 있게 될 것입니다.","Lutte autant que tu peux, la matière noire finira par t'effacer, et je pourrai apporter la véritable <Red:「Transformation」> au monde - l'immortalité pour tous","Sträube dich so viel du willst, die schwarze Materie wird dich letztendlich auslöschen, und dann werde ich der Welt die wahre <Red:„Transformation“> bringen – Unsterblichkeit für alle","Lute o quanto puder, a matéria negra acabará com você, e eu trarei a verdadeira <Red:「transformação」> ao mundo - imortalidade para todos",ดิ้นรนให้สุดความสามารถเถอะ มวลดำจะลบล้างตัวตนของเจ้าไปในที่สุด และเมื่อนั้นข้าจะสามารถนำพา<Red:「การเปลี่ยนแปลง」>ที่แท้จริงมาสู่โลกนี้ได้——ทุกคนจะได้เป็นอมตะ ทุกคนจะได้มีชีวิตนิรันดร์,"Berjuanglah sekuat tenaga, substansi hitam pada akhirnya akan menghapusmu. Pada saat itu, aku akan membawa <Red:「transformasi」> sejati ke dunia — semua orang akan menjadi abadi, semua orang akan hidup selamanya.","Hãy cố gắng vùng vẫy đi, vật chất đen tối cuối cùng cũng sẽ xóa bỏ ngươi, đến lúc đó ta có thể mang lại sự <Red:「lột xác」> thật sự cho thế giới —— mọi người đều có thể bất tử, mọi người đều có thể sống mãi."
AvgDialog_15607_Content_8,adRZ,avgV1.0艾瑞卡小型支线_AvgDialog_C_M.csv,210,AvgDialog,Content,艾瑞卡,那是……死……不是……,That is... death... not...,То...смерть...Не..,Eso es... muerte... no,それは……死……ではない……,그것은…… 죽음이…… 아니에요……,C'était... la mort... non,Das ist... Tod... nein,Aquilo é... morte... não,นั่นคือ... ความตาย... ไม่ใช่..,Itu adalah... kematian... bukan...,Đó là... có lẽ là chết... nhưng không phải..
AvgDialog_15607_Content_9,adSa,avgV1.0艾瑞卡小型支线_AvgDialog_C_M.csv,211,AvgDialog,Content,,黑色越来越多地占据她的身体，艾瑞卡痛苦地弯下腰，精神已经濒临溃散。,"The color black increasingly consumed her body. Erica bent over in pain, her spirit on the verge of collapse.","Чёрный цвет всё больше овладевает её телом, Эрика мучительно сгибается, дух уже близок к краху.","El negro ocupaba cada vez más su cuerpo, Erica se doblaba de dolor, su mente al borde del colapso",黒い色が彼女のからだをますます支配し，エリカは苦しみながら腰を曲げ，精神はすでに崩壊寸前だった。,"검은색이 점점 더 그녀의 몸을 차지하며, 에리카는 고통스럽게 몸을 구부렸고, 정신은 이미 붕괴 직전이었다.","Le noir occupe de plus en plus son corps, Erica se penche douloureusement, son esprit au bord de l'effondrement","Immer mehr Schwarz durchdrängt ihren Körper; Erica beugt sich schmerzhaft vor, ihr Geist ist kurz vor dem Zusammenbruch","O negro ocupava cada vez mais seu corpo, Erica se curvava de dor, à beira do colapso mental",สีดำค่อยๆ เข้าควบคุมร่างกายของเธอมากขึ้น เอริกาทรุดตัวลงด้วยความเจ็บปวด จิตใจของเธอกำลังจะพังทลาย,"Warna hitam semakin banyak menguasai tubuhnya. Erica membungkuk dalam rasa sakit, dan rohnya sudah hampir runtuh.","Sắc đen ngày càng chiếm nhiều phần thân thể của cô, Erika cúi người đau đớn, tinh thần đã gần như sụp đổ."
AvgDialog_15607_Content_10,adRA,avgV1.0艾瑞卡小型支线_AvgDialog_C_M.csv,212,AvgDialog,Content,艾瑞卡,我……到底都……做了什么……,What... have I... done...,Я... в конце концов... что я... сделал..,¿Qué... he hecho...?,私……いったい何を……したのか……,나…… 도대체…… 무엇을…… 했던가……,: Qu'ai-je fait,Ich... was habe ich... getan,Eu... o que eu... fiz,ฉัน... ทำอะไรลงไป... ทั้งหมดนี้..,Aku... apa yang telah aku... lakukan...,Tôi... rốt cuộc đã... làm gì..
AvgDialog_15607_Content_11,adRB,avgV1.0艾瑞卡小型支线_AvgDialog_C_M.csv,213,AvgDialog,Content,？？？,你还是不理解，不过没关系，你已经推动了这场生命与灵魂的革命，这场<Red:「蜕变」>。\n安心地死去吧，我却确保所有人都记得你的贡献。,"You still don't understand, but that's okay. You've already ignited the revolution of Life and Soul, this <Red:""Metamorphosis"">.\nRest in peace. I will ensure everyone remembers your contribution.",#N/A,#N/A,#N/A,#N/A,#N/A,#N/A,#N/A,#N/A,#N/A,#N/A
AvgDialog_15607_Content_12,adRC,avgV1.0艾瑞卡小型支线_AvgDialog_C_M.csv,214,AvgDialog,Content,,艾瑞卡闭上眼。,Erica closed her eyes.,Эрика закрыла глаза.,Erika cerró los ojos,エリカは目を閉じた。,에리카가 눈을 감는다.,Erica ferme les yeux,Erica schloss die Augen,Erica fechou os olhos,เอริกาปิดตาลง.,Erica menutup matanya.,Erika đóng mắt lại.
AvgDialog_15607_Content_13,adRD,avgV1.0艾瑞卡小型支线_AvgDialog_C_M.csv,215,AvgDialog,Content,艾瑞卡人形,你是……对的，你一直都是……,"You're... right, you've always been right...","Ты... прав, ты всегда был прав..","¿Eres... correcto, siempre lo has sido",あなたは……そうね、あなたはずっと……,"너는…맞아, 너는 항상…",Es-tu... tu as toujours eu raison,"Du bist... richtig, du warst es immer","Você é... certo, sempre foi",คุณคือ... ใช่แล้ว คุณเสมอมา..,"Kamu... benar, kamu selalu begitu...","Bạn là……đúng vậy, bạn luôn là……"
AvgDialog_15607_Content_14,adRE,avgV1.0艾瑞卡小型支线_AvgDialog_C_M.csv,216,AvgDialog,Content,,黑色的泪水从她眼角滑落，她皱着鼻子，突然转头看向你。,Black tears slid from the corners of her eyes as she wrinkled her nose and suddenly turned to look at you.,"Чёрные слёзы скатились по её щеке, она сморщила нос и внезапно повернула голову к тебе.","Lágrimas negras rodaron por sus mejillas, arrugó la nariz y de repente te miró",黒い涙が彼女の目尻を伝い、彼女は鼻をしかめ、突然あなたの方を振り向いた。,검은색 눈물이 그녀의 눈가를 타고 흘러내렸다. 그녀는 코를 찡그리며 갑자기 고개를 돌려 당신을 바라보았다.,"Des larmes noires coulent de ses yeux, elle fronce le nez et se tourne soudainement vers toi","Schwarze Tränen laufen über ihre Wangen, sie rümpft die Nase und schaut plötzlich zu dir","Lágrimas negras escorrem de seus olhos, ela franze o nariz e de repente olha para você",น้ำตาสีดำไหลผ่านหางตาของเธอ เธอขมวดจมูกแล้วหันขวับมามองคุณ,"Air mata hitam mengalir dari sudut matanya. Dia mengerutkan hidungnya, lalu tiba-tiba menoleh ke arahmu.","Nước mắt đen lăn từ khóe mắt cô ấy, với dáng vẻ cau mày khó chịu, cô đột ngột quay đầu nhìn bạn."
AvgDialog_15607_Content_15,adRF,avgV1.0艾瑞卡小型支线_AvgDialog_C_M.csv,217,AvgDialog,Content,艾瑞卡人形,我一开始就……应该听……你的……我……不该拿这个东西……,I should have... listened to... you from the very beginning... I... shouldn't have taken this thing...,Я с самого начала... должен был слушать... тебя... Я... не должен был брать эту штуку..,Desde el principio... debería haber escuchado... a ti... No debería haber tomado esto,最初から……君の言うことを……聞いておくべきだった……私は……これを取るべきではなかった……,처음부터……당신의 말을 들어야 했어……나는……이 물건을 가져선 안 됐어……,"Dès le début, j'aurais dû... t'écouter... je... n'aurais pas dû prendre cet objet",Ich hätte von Anfang an... auf dich hören sollen... Ich hätte dieses Ding nicht nehmen sollen,Eu deveria ter... ouvido você desde o começo... Eu... não deveria ter pegado isso,ฉันควรจะ...ฟัง...คุณตั้งแต่แรก... ฉัน...ไม่น่าเอาสิ่งนี้มาเลย..,Saya seharusnya... mendengarkan... kamu dari awal... Saya... tidak seharusnya mengambil benda ini...,Tôi từ đầu... đã nên nghe... lời của cậu... Tôi... không nên cầm cái này..
AvgDialog_15607_Content_16,adRG,avgV1.0艾瑞卡小型支线_AvgDialog_C_M.csv,218,AvgDialog,Content,艾瑞卡人形,我的理智……我的……帮我……这最后一次……,My sanity... my... help me... this one last time...,Мой разум... мой... помоги... в этот последний раз..,Mi cordura... mi... ayúdame... esta última vez,私の理性……私の……助けて……これが最後に……,내 정신…… 내…… 도와줘…… 마지막으로……,Ma raison... Aide-moi... une dernière fois,Mein Verstand... mein... hilf mir... dieses letzte Mal,Minha sanidade... Minha... Ajude-me... Só mais uma vez,สติของฉัน... ของฉัน... ช่วยฉันด้วย... ครั้งสุดท้ายนี้..,Akalku... aku... tolong... untuk terakhir kalinya...,Lý trí của tôi…… tôi…… giúp tôi…… lần cuối cùng này……
AvgDialog_15607_Content_17,adRH,avgV1.0艾瑞卡小型支线_AvgDialog_C_M.csv,219,AvgDialog,Content,,这具躯体里真的有第三个意识吗，还是说，你不过是她的负罪感在融蚀影响下的具象化？你不得而知。,"Is there really a third consciousness in this <Body>, or are you merely the embodiment of her guilt under the influence of <Dissolution>? You cannot tell.","Имеется ли действительно третий разум в этом теле, или же ты ещё всего лишь осязаемое проявление её греха под влиянием растворению? Ты не знаешь.","¿Hay una tercera conciencia en este cuerpo, o eres solo una manifestación de su culpa bajo la influencia de la corrupción? No lo sabes",このからだの中に本当に三つ目の意識が存在するのか、または、あなたは彼女の罪悪感が融食の影響下で具体化しただけなのか、あなたにはわからない。,"이 몸체 안에 정말 세 번째 의식이 있는 것일까, 아니면 너는 그녀의 죄책감이 융식 영향 아래에서 구체화된 결과일까? 너는 알 수 없다.","Y a-t-il vraiment une troisième conscience dans ce corps, ou es-tu simplement la manifestation de sa culpabilité sous l'influence de la fusion ? Tu ne le sais pas","Gibt es wirklich ein drittes Bewusstsein in diesem Körper, oder bist du nur eine Manifestation ihres Schuldgefühls? Du weißt es nicht","Há realmente uma terceira consciência neste corpo, ou você é apenas a personificação da culpa dela sob a influência da fusão? Você não sabe",ในร่างกายนี้มีจิตสำนึกที่สามจริงหรือ? หรือว่าเธอเป็นเพียงภาพปรากฏของความรู้สึกผิดภายใต้อิทธิพลของการหลอมกร่อน? เธอไม่อาจรู้ได้,"Apakah benar ada kesadaran ketiga dalam tubuh ini, atau mungkin, kau hanyalah personifikasi dari rasa bersalahnya yang dipengaruhi oleh pelarutan? Kau tak akan pernah tahu.","Có thực sự có một ý thức thứ ba trong thân thể này, hay chỉ là, bạn chẳng qua là sự cụ thể hóa dưới ảnh hưởng của sự xói mòn tâm lý từ cảm giác tội lỗi của cô ấy? Bạn không thể biết."
AvgDialog_15607_Content_18,adRI,avgV1.0艾瑞卡小型支线_AvgDialog_C_M.csv,220,AvgDialog,Content,,她朝你伸出手。,She extends her hand to you.,Она протягивает тебе руку.,Ella te extendió la mano,彼女はあなたに手を差し伸べた。,그녀가 당신에게 손을 뻗습니다.,Elle te tend la main,Sie streckte dir die Hand entgegen,Ela estendeu a mão para você,เธอยื่นมือมาหาคุณ,Dia mengulurkan tangannya ke arahmu.,Cô ấy nhẹ nhàng đưa tay ra phía bạn.
AvgDialog_15607_Content_19,adRJ,avgV1.0艾瑞卡小型支线_AvgDialog_C_M.csv,221,AvgDialog,Content,艾瑞卡人形,帮我……救……,Help... me... save...,Помоги... спасти..,Ayúdame... salva,助けて……,도와줘……구해줘……,Aide-moi... sauve,Hilf mir... rette,Ajude-me... salve,ช่วยฉัน... ช่วย..,Tolong aku... selamatkan aku...,Giúp tôi…cứu…
AvgDialog_15607_Content_20,adRL,avgV1.0艾瑞卡小型支线_AvgDialog_C_M.csv,222,AvgDialog,Content,,你只知道你会帮她，见证她作为「人类」的结局。,"You only know that you will help her and witness her fate as a ""human"".","Ты знаешь, что будешь помогать ей и стать свидетелем её конца как 《Человека》.","Solo sabes que la ayudarás y serás testigo de su destino como ""humana""",あなたはただ、彼女を助けること、彼女が「人間」としての結末を目撃することを知っているだけだ。,"너는 그녀를 돕고, 그녀가 “인간”으로서의 결말을 증언할 것만 알고 있다.","Tu sais seulement que tu l'aideras, témoignant de son destin en tant qu'「humain」","Du weißt nur, dass du ihr helfen wirst, ihr Ende als „Mensch“ zu erleben","Você só sabe que vai ajudá-la, testemunhando seu fim como ""humana""",คุณรู้แค่ว่าจะช่วยเธอ และเป็นสักขีพยานในบทสรุปของเธอในฐานะ「มนุษย์」,"Kamu hanya tahu bahwa kamu akan membantunya, menyaksikan akhirnya sebagai 「manusia」.","Bạn chỉ biết rằng bạn sẽ giúp cô ấy, chứng kiến kết cục của cô ấy với tư cách là một 「con người」."
AvgDialog_15607_Content_21,adRM,avgV1.0艾瑞卡小型支线_AvgDialog_C_M.csv,223,AvgDialog,Content,,握住她的手,Hold her hand,Сожми её руку,Toma su mano,彼女の手を握る,그녀의 손을 잡아라,Tiens sa main,Halte ihre Hand,Segure a mão dela,กุมมือเธอ,Menggenggam tangannya,Nắm tay cô ấy
