Key,ShortKey,Source,Row,Module,Field,Character,CN,EN,RU,ES,JP,KR,FR,DE,PT,TH,IN,VI,,
AvgDialog_19062_Content_15,agMQ,avg章4_AvgDialog_C_M.csv,254,AvgDialog,Content,朵尔,你稍事休息，我们很快就能进去找你的好搭档了。,Take a short break. We'll soon go in and find your good partner.,"Отдых, мы скоро войдём и найдём твоего хорошего напарника.","Descansa un poco, pronto entraremos a buscar a tu compañero",少し休憩して、すぐに君の相棒のもとに行くよ。,잠시 쉬고 있으면 곧 당신의 좋은 파트너를 찾아갈 수 있을 거예요.,"Repose-toi un peu, nous pourrons bientôt aller chercher ton partenaire","Ruh dich kurz aus, wir können bald deinen Partner finden","Descanse um pouco, logo entraremos para encontrar seu parceiro",คุณพักสักครู่ เราจะรีบเข้าไปหาเพื่อนร่วมทีมของคุณเร็วๆ นี้,"Kamu bisa beristirahat sejenak, kami akan segera masuk untuk menemui rekan baikmu.","Bạn hãy nghỉ ngơi một chút, chúng ta sẽ vào tìm đồng đội tốt của bạn ngay thôi.",,
AvgDialog_19062_Content_16,agMR,avg章4_AvgDialog_C_M.csv,255,AvgDialog,Content,,同一时间\n拉伊精神疗养院·手术室内,"At the same time\nRye Sanatorium: Operating Room",#N/A,#N/A,#N/A,#N/A,#N/A,#N/A,#N/A,#N/A,#N/A,#N/A,,
AvgDialog_19062_Content_17,agMS,avg章4_AvgDialog_C_M.csv,256,AvgDialog,Content,,拉蒙娜在柔软的床铺上醒来，眼前是女孩子担忧的面容。,"Ramona woke up on a soft bed, facing a girl with a worried expression.","Рамона проснулась на мягкой постели, перед ней было обеспокоенное лицо девушки.","Ramona despertó en una cama suave, con el rostro preocupado de una chica frente a ella",ラモナは柔らかいベッドで目を覚まし、目の前には心配げな女の子の顔があった。,"라몬나는 부드러운 침대에서 깨어났고, 눈앞에는 소녀의 걱정스러운 얼굴이 보였다.","Ramona se réveille dans un lit moelleux, avec le visage inquiet d'une fille devant elle","Ramona wachte in einem weichen Bett auf, vor ihr das besorgte Gesicht eines Mädchens","Ramona acordou em uma cama macia, vendo o rosto preocupado de uma garota",รามอน่า ตื่นขึ้นมาบนเตียงที่นุ่มสบาย ใบหน้าที่เป็นกังวลของผู้หญิงอยู่ตรงหน้าเธอ,"Ramona terbangun di atas ranjang yang lembut, dengan wajah cemas seorang gadis di hadapannya.","Ramona thức dậy trên chiếc giường mềm mại, trước mắt là gương mặt đầy lo âu của một cô gái.",,
AvgDialog_19062_Content_18,agMT,avg章4_AvgDialog_C_M.csv,257,AvgDialog,Content,拉蒙娜,<SmallShake:这里……是哪里？我……睡了多久？>,<SmallShake:Where... am I? How long... have I been asleep?>,<SmallShake:Где... это? Я... сколько я спал?>,<SmallShake:¿Dónde... estoy? ¿Cuánto tiempo he dormido?>,<SmallShake:ここ……どこ？私……どれくらい寝ていたの……？>,<SmallShake:여기…어디야? 나는…얼마나 잤지?>,<SmallShake:Où... suis-je? Combien de temps ai-je dormi?>,<SmallShake:Wo... bin ich? Wie lange habe ich geschlafen?>,<SmallShake:Onde... estou? Quanto... tempo dormi?>,<SmallShake:ที่นี่ ... คือที่ไหน? ฉัน ... หลับไปนานแค่ไหนแล้ว?>,<SmallShake:Ini…… di mana? Aku…… sudah tidur selama berapa lama?>,<SmallShake:đây…là đâu? Tôi…đã ngủ bao lâu?>,,
AvgDialog_19062_Content_19,agMU,avg章4_AvgDialog_C_M.csv,258,AvgDialog,Content,,她扶着额头坐起身，夕阳的光线从窗口射入，将这里映成一片暖色的海洋。,"She propped herself up, holding her forehead. The light of the setting sun streamed through the window, turning the room into a sea of warm colors.","Она подняла руку ко лбу и села, лучи закатного солнца проникали через окно, превращая пространство в океан теплых оттенков.","Se sentó sosteniéndose la frente, con la luz del atardecer entrando por la ventana, bañando el lugar en un mar de cálidos colores",彼女は額を支えて起き上がり、夕日の光が窓から差し込み、ここを暖色の海のように照らしている。,그녀는 이마를 짚으며 상체를 일으켰다. 석양의 빛이 창문으로 스며들어 이곳을 따뜻한 색의 바다로 물들였다.,"Elle se redressa en se tenant la tête, les rayons du soleil couchant inondant la pièce d'une mer de chaleur","Sie setzte sich mit der Hand an der Stirn auf, und das Licht der untergehenden Sonne strömte durch das Fenster und tauchte den Raum in ein warmes Meer","Ela se sentou segurando a cabeça, com a luz do pôr do sol entrando pela janela, transformando o lugar em um mar de calor",เธอลูบหน้าผากแล้วลุกขึ้นนั่ง แสงของดวงอาทิตย์ยามเย็นส่องเข้ามาทางหน้าต่าง ทำให้ที่นี่กลายเป็นทะเลสีส้มทอง,"Dia memegang dahinya dan bangkit duduk, cahaya senja masuk melalui jendela, mengubah tempat ini menjadi lautan berwarna hangat.","Cô ấy chống trán ngồi dậy, tia nắng hoàng hôn chiếu qua cửa sổ, biến nơi đây thành một đại dương màu sắc ấm áp.",,
AvgDialog_19062_Content_20,agMW,avg章4_AvgDialog_C_M.csv,259,AvgDialog,Content,,……竟然有几分温馨。,...it was actually quite cozy.,...оказалось даже немного уютно.,……Sorprendentemente acogedor,……なんとなく少し温かい。,……어느 정도의 온기가 느껴진다.,……Étonnamment chaleureux,……Es ist tatsächlich ein wenig gemütlich,……Surpreendentemente acolhedor,...กลับรู้สึกอบอุ่นขึ้นมาเล็กน้อย,... ternyata terasa agak hangat.,……không ngờ có chút ấm áp.,,
AvgDialog_19062_Content_21,agMX,avg章4_AvgDialog_C_M.csv,260,AvgDialog,Content,拉蒙娜,不，不是错觉……,"No, it's not an illusion...","Нет, не иллюзия..","No, no es una ilusión",いいえ、錯覚じゃない…,"아니요, 착각이 아닙니다…","Non, ce n'est pas une illusion","Nein, das ist keine Täuschung","Não, não é uma ilusão",ไม่ใช่ ไม่ใช่ภาพลวงตา..,"Tidak, bukan ilusi...","Không, không phải ảo giác…",,
AvgDialog_19062_Content_22,agMY,avg章4_AvgDialog_C_M.csv,261,AvgDialog,Content,,拉蒙娜呢喃。,Ramona mutters to herself.,Рамона шепот.,Ramona murmuró,ラモナがささやきを。,라몬나가 나지막이 말했다.,Ramona murmure,Ramona murmelte,Ramona murmurou,รามอน่า กระซิบ.,Ramona bergumam.,Ramona thì thầm. ,,
AvgDialog_19062_Content_23,agMZ,avg章4_AvgDialog_C_M.csv,262,AvgDialog,Content,,若非床铺旁的手术器械反射出冰冷尖锐的光芒，这里的陈设显然是某个女孩的卧室。,"If not for the cold, sharp gleam of surgical instruments by the bedside, the furnishings here would clearly belong to a girl's bedroom.","Если бы не ледяной и резкий блеск хирургических инструментов рядом с кроватью, обстановка явно указывала бы на спальню какой-то девочки.","Si no fuera por el reflejo frío y afilado de los instrumentos quirúrgicos junto a la cama, este lugar claramente sería el dormitorio de una niña",手術器具がベッドの横で冷たく鋭く光を放っていないなら、ここは明らかに女の子の部屋のようだ。,"침대 옆의 수술 도구가 차갑고 날카로운 빛을 반사하지 않았다면, 이곳의 인테리어는 확실히 어떤 소녀의 방이었을 것이다.","Si les instruments chirurgicaux à côté du lit ne reflétaient pas une lumière froide et tranchante, cette pièce serait manifestement celle d'une jeune fille","Wären da nicht die kalten, scharfen Reflexionen der chirurgischen Instrumente neben dem Bett, wäre dies eindeutig das Zimmer eines Mädchens","Se não fosse pelo brilho frio e afiado dos instrumentos cirúrgicos ao lado da cama, este claramente seria o quarto de uma menina",หากไม่ใช่เพราะแสงสะท้อนเย็นชาและแหลมคมของเครื่องมือผ่าตัดข้างเตียง ที่นี่ชัดเจนว่าเป็นห้องนอนเด็กสาว,"Jika bukan karena peralatan bedah di samping tempat tidur yang memantulkan cahaya dingin dan tajam, suasana di sini jelas menyerupai kamar tidur seorang gadis.","Nếu không có dụng cụ phẫu thuật bên cạnh giường phản chiếu ánh sáng lạnh lẽo và sắc nhọn, thì cách bài trí ở đây rõ ràng là phòng ngủ của một cô gái.",,
AvgDialog_19062_Content_24,agNa,avg章4_AvgDialog_C_M.csv,263,AvgDialog,Content,莉莉,拉蒙娜姐姐，你该回去了。把库姆……也带走吧。,"Ramona, you should go back. Koum... you should take Koum with you as well.","Сестра Рамона, тебе пора возвращаться. Возьми с собой и Кума...","Hermana Ramona, deberías regresar. Llévate a Koom también",ラモナおねえさん、あなたは帰るべきです。クム……も連れて行ってください。,"라몬나 누나, 돌아가야 해요. 쿰도… 데리고 가세요.","Ramona, tu devrais rentrer. Emmène aussi Koom","Ramona, du solltest zurückgehen. Nimm auch Kumm mit","Irmã Ramona, você deve voltar. Leve Kumu... também",พี่รามอน่า คุณควรกลับไปแล้ว แล้วพาคูม... ไปด้วยเถอะ,"Kak Ramona, sudah waktunya kamu kembali. Bawa juga Kum... pergi.","Chị Ramona, chị nên về đi. Đưa Kum… cùng đi nữa.",,
AvgDialog_19062_Content_25,agNb,avg章4_AvgDialog_C_M.csv,264,AvgDialog,Content,,女孩没有回应拉蒙娜的问题，自说自话地抛下一句，又侧身去抚摸库姆的脑袋。,"The girl didn't respond to Ramona's question. Instead, she muttered something under her breath and turned to pat Koum's head.","Девочка не ответила на вопрос Рамоны, а сама небрежно бросила фразу и повернулась погладить голову кума.","La niña no respondió a la pregunta de Ramona, murmuró algo y acarició la cabeza de Kum",女の子はラモナの質問に答えず、独り言のように言ってから、体を横向けにしてクムの頭をなでた。,소녀는 라몬나의 질문에 대답하지 않고 혼잣말을 하고는 몸을 돌려 쿰의 머리를 무르기했다.,"La fille ne répondit pas à la question de Ramona, lança une phrase à elle-même, puis caressa la tête de Koum","Das Mädchen antwortete nicht auf Ramonas Frage, sondern sagte etwas für sich und streichelte dann Kums Kopf","A menina não respondeu à pergunta de Ramona, disse algo para si mesma e virou-se para acariciar a cabeça de Kum",เด็กหญิงไม่ตอบคำถามของรามอน่า พูดลอยๆ ประโยคหนึ่งแล้วหันไปลูบหัวคุมอีกครั้ง,"Gadis itu tidak merespons pertanyaan Ramona, malah mengatakan sesuatu dengan nada datar lalu membelai kepala Kum setelah memiringkan tubuhnya.","Cô gái không đáp lại câu hỏi của Ramona, tự lẩm bẩm một câu rồi nghiêng người sang vuốt ve đầu Kume.",,
AvgDialog_19062_Content_26,agNc,avg章4_AvgDialog_C_M.csv,265,AvgDialog,Content,拉蒙娜,那你呢？,What about you?,А ты?,¿Y tú?,那你ね？,그럼 너는?,Et toi ?,Und du?,E você?,แล้วคุณล่ะ?,Bagaimana denganmu?,Bạn thì sao?,,
AvgDialog_19062_Content_27,agNd,avg章4_AvgDialog_C_M.csv,266,AvgDialog,Content,莉莉,出去太久的话，会被<Yellow:祂>发现的。,"If we stay out too long, <Yellow:It> will notice.","Если задержишься надолго, тебя обнаружит <Yellow:Бог>.","Si sales demasiado tiempo, <Yellow:Él> te encontrará",外に出ている時間が長すぎると、<Yellow:神>に発見される。,너무 오래 나가 있으면 <Yellow:그분님>이 발견할 거야.,"Si tu restes trop longtemps dehors, <Yellow:Il> te trouvera","Wenn du zu lange draußen bleibst, wird <Yellow:Er> dich entdecken","Se você ficar fora por muito tempo, <Yellow:Ele> vai te encontrar",ถ้าออกไปข้างนอกนานเกินไป จะโดน<Yellow:ท่าน>จับได้นะ,"Jika keluar terlalu lama, <Yellow:Dia> akan menemukannya.","Nếu ra ngoài quá lâu, <Yellow:Người> sẽ phát hiện ra.",,
AvgDialog_19062_Content_28,agNe,avg章4_AvgDialog_C_M.csv,267,AvgDialog,Content,拉蒙娜,祂？……是指“地狱犬”吗？,"Is ""It""... referring to the ""Hellhound""?",Он?.. Вы имеете в виду 《адский пёс》?,¿Él? … ¿se refiere al “sabueso infernal”?,彼？ ……「地獄犬」のことを指しているのか？,"그분?……""헬독""을 의미하나요?","Lui ?... fait-il référence au ""chien des enfers"" ?","Er? ... Meinst du den ""Höllenhund""?","Ele? ... Refere-se ao ""cão infernal""?","พระองค์？……หมายถึง ""สุนัขแห่งนรก"" ใช่ไหม？","Dia? ... Apakah yang dimaksud adalah ""Anjing neraka""?","Ngài?… là chỉ ""chó địa ngục"" sao?",,
AvgDialog_19062_Content_29,agNf,avg章4_AvgDialog_C_M.csv,268,AvgDialog,Content,拉蒙娜,莉莉，不要害怕，我们来自一所专门对抗异常现象的大学，一定有办法保护你的。,"Lily, don't be afraid. We come from a university specializing in combating anomalies. We will find a way to protect you.","Лили, не надо бояться, мы из университета, специализирующегося на борьбе с аномальными явлениями, у нас обязательно найдется способ тебя защитить.","Lily, no tengas miedo, venimos de una universidad especializada en combatir fenómenos anómalos, encontraremos una manera de protegerte",リリ、怖がらないで、我々は異常現象と対抗する専門の大学から来ています。きっとあなたを守る方法があるでしょう。,"리리, 두려워하지 마세요. 우리는 비정상적인 현상을 연구하고 대처하는 대학에서 왔어요. 당신을 보호할 방법이 분명히 있을 거예요.","Lily, n'aie pas peur, nous venons d'une université spécialisée dans la lutte contre les phénomènes anormaux, nous trouverons un moyen de te protéger","Lily, hab keine Angst, wir kommen von einer Universität, die sich auf die Bekämpfung von Anomalien spezialisiert hat. Wir werden dich beschützen","Lily, não tenha medo. Viemos de uma universidade especializada em combater fenômenos anômalos. Vamos te proteger",ลิลลี่ อย่ากลัว เราเป็นนักศึกษาจากมหาวิทยาลัยที่เชี่ยวชาญในการต่อสู้กับปรากฏการณ์ผิดปกติ จะต้องมีวิธีป้องกันคุณได้อย่างแน่นอน。,"Lily, jangan takut. Kami berasal dari universitas yang khusus menangani fenomena abnormal, dan pasti ada cara untuk melindungimu.","Lily, đừng sợ. Chúng tôi từ một đại học chuyên xử lý hiện tượng bất thường, chắc chắn có cách bảo vệ bạn.",,
AvgDialog_19062_Content_30,agNh,avg章4_AvgDialog_C_M.csv,269,AvgDialog,Content,莉莉,不，没有人能逃过祂的视线。\n被祂盯上的人，最终都会成为祂的猎物。,"No, no one can escape Its gaze.\nThose who are targeted by It will eventually become Its prey.",#N/A,#N/A,#N/A,#N/A,#N/A,#N/A,#N/A,#N/A,#N/A,#N/A,,
AvgDialog_19062_Content_31,agNi,avg章4_AvgDialog_C_M.csv,270,AvgDialog,Content,莉莉,而且，莉莉还需要陪着母亲。\n母亲一个人，太孤单了。,"Moreover, Lily needs to stay with her mother. \nHer mother would be too lonely by herself.",#N/A,#N/A,#N/A,#N/A,#N/A,#N/A,#N/A,#N/A,#N/A,#N/A,,
AvgDialog_19062_Content_32,agNj,avg章4_AvgDialog_C_M.csv,271,AvgDialog,Content,拉蒙娜,她对你，对库姆都犯下了残忍的罪行，我不会放任她逃过制裁。,She has committed cruel acts against you and Koum. I won't let her escape justice.,"Она совершила жестокие преступления против тебя и кума, я не позволю ей избежать наказания.","Ella cometió crímenes atroces contra ti y Kum, no permitiré que escape del castigo",彼女はあなたとクムに対して残酷な罪を犯しました。私は彼女が制裁を逃れるのを許しません。,그녀는 당신과 쿰에게 잔인한 범죄를 저질렀습니다. 그녀가 제재를 피하지 못하게 하겠습니다.,"Elle a commis des crimes cruels contre toi et Koom, je ne la laisserai pas échapper à la justice","Sie hat grausame Verbrechen an dir und Kum begangen, ich werde nicht zulassen, dass sie der Strafe entgeht","Ela cometeu crimes cruéis contra você e Kum, não vou deixá-la escapar da punição",เธอก่ออาชญากรรมที่โหดร้ายต่อคุณและคูม ฉันจะไม่ยอมให้เธอหลีกเลี่ยงการลงโทษเด็ดขาด,Dia telah melakukan kejahatan kejam terhadapmu dan terhadap Kum. Aku tidak akan membiarkannya lolos dari hukuman.,"Cô ta đã phạm tội ác dã man đối với bạn và Kume, tôi sẽ không để cô ta thoát khỏi trừng phạt.",,
AvgDialog_19062_Content_33,agNk,avg章4_AvgDialog_C_M.csv,272,AvgDialog,Content,莉莉,不，母亲没有骗人。\n库姆变成这样…不是母亲的错。,"No, mother didn't lie.\nKoum turning out this way... isn't her fault.",#N/A,#N/A,#N/A,#N/A,#N/A,#N/A,#N/A,#N/A,#N/A,#N/A,,
AvgDialog_19062_Content_34,agNl,avg章4_AvgDialog_C_M.csv,273,AvgDialog,Content,拉蒙娜,你能把你知道的告诉我吗？,Can you tell me what you know?,"Можете ли вы рассказать мне то, что знаете?",¿Puedes decirme lo que sabes?,あなたが知っていることを教えていただけますか？,당신이 아는 것을 나에게 말해줄 수 있나요?,Peux-tu me dire ce que tu sais ?,"Kannst du mir sagen, was du weißt?",Você pode me contar o que sabe?,คุณสามารถบอกสิ่งที่คุณรู้ให้ฉันฟังได้ไหม?,Bisakah kamu memberitahuku apa yang kamu tahu?,Bạn có thể nói cho tôi biết những gì bạn biết?,,
AvgDialog_19062_Content_35,agNm,avg章4_AvgDialog_C_M.csv,274,AvgDialog,Content,莉莉,来不及了。,No time left.,Не успеваю.,Es demasiado tarde,間に合わない。,늦었어.,Trop tard,Zu spät,É tarde demais,ไม่ทันแล้ว。,Tidak ada waktu lagi.,Không kịp rồi.,,
AvgDialog_19062_Content_36,agNn,avg章4_AvgDialog_C_M.csv,275,AvgDialog,Content,,莉莉脸上罕见地浮现出悲戚的神色。,A rare sorrowful expression appeared on Lily's face.,На лице Лили редко появлялось горестное выражение.,Una rara expresión de tristeza apareció en el rostro de Lily,リリの顔に珍しく悲しげな表情が浮かんだ。,리리의 얼굴에 드물게 슬픔의 빛이 감돌았다.,Un rare air de tristesse apparaît sur le visage de Lily,Auf Lily's Gesicht erschien selten ein trauriger Ausdruck,Uma expressão rara de tristeza apareceu no rosto de Lily,ลิลลี่แสดงสีหน้าเศร้าใจที่หาได้ยาก,Wajah Lily jarang menampakkan ekspresi yang begitu sedih.,"Trên khuôn mặt Lily, hiếm khi hiện lên vẻ buồn bã sâu sắc.",,
AvgDialog_19062_Content_37,agNo,avg章4_AvgDialog_C_M.csv,276,AvgDialog,Content,莉莉,库姆，带她走。,"Koum, take her away.","Кум, уводи её.","Kum, llévatela",クム、彼女を連れて行け。,"쿰, 그녀를 데리고 가.","Koum, emmène-la","Kum, bring sie weg","Kum, leve-a embora",คุมม์ พาเธอไป,"Khum, bawa dia pergi.","Khum, đưa cô ấy đi!",,
AvgDialog_19062_Content_38,agNp,avg章4_AvgDialog_C_M.csv,277,AvgDialog,Content,,身后传来了门把拧动的吱呀声。,The creaking sound of a doorknob turning came from behind.,За спиной раздался скрип поворачивающейся дверной ручки.,"Detrás de ti, escuchaste el chirrido de una manija girando",背後からドアのノブが回るきしむ音が聞こえた。,뒤에서 문고리가 삐걱거리는 소리가 났다.,Un grincement de poignée de porte se fait entendre derrière toi,Hinter dir ertönt das Quietschen einer sich drehenden Türklinke,Ouviu-se o som da maçaneta da porta girando atrás de você,ข้างหลังมีเสียงบิดลูกบิดประตูดังเอี๊ยด,Dari belakang terdengar suara berderit ketika gagang pintu diputar.,Có tiếng cửa sau lưng ken két vang lên.,,
AvgDialog_19062_Content_39,agNq,avg章4_AvgDialog_C_M.csv,278,AvgDialog,Content,,库姆应声将拉蒙娜衔起，甩上自己的后背。\n拉蒙娜试图抵抗，却被黑色黏液牢牢束缚在了库姆的身上。,"Koum swiftly grabbed Ramona and flung her onto her back.\nRamona attempted to resist, but the black slime firmly bound her to Koum.",#N/A,#N/A,#N/A,#N/A,#N/A,#N/A,#N/A,#N/A,#N/A,#N/A,,
AvgDialog_19062_Content_40,agNs,avg章4_AvgDialog_C_M.csv,279,AvgDialog,Content,莉莉,别再回来了，忘掉我，忘掉这里的一切……\n母亲不会再伤害任何人……,"Don't come back. Forget me, forget everything here...\nMother won't hurt anyone ever again…",#N/A,#N/A,#N/A,#N/A,#N/A,#N/A,#N/A,#N/A,#N/A,#N/A,,
AvgDialog_19062_Content_41,agNt,avg章4_AvgDialog_C_M.csv,280,AvgDialog,Content,,在来人惊愕的目光下，库姆突然迎头撞了上去。,"Under the astonished gaze of Francis, Koum suddenly charged straight ahead.",В изумлённых взглядах окружающих кум внезапно бросился вперёд.,"Ante la mirada atónita del recién llegado, Kum se lanzó de cabeza",来人の驚愕した視線の下、クムは突然正面からぶつかっていった。,"놀란 시선 아래, 쿰은 갑자기 앞으로 머리를 들이밀었다.","Sous le regard stupéfait des arrivants, Koom a soudain foncé en avant",Unter den erstaunten Blicken der Ankömmlinge stürzte Kum plötzlich vorwärts,"Sob o olhar atônito dos presentes, Kum de repente avançou de cabeça",ขณะที่คนที่มาถึงยังตกตะลึง คูมก็พุ่งเข้าชนอย่างแรง,"Di bawah tatapan terkejut orang yang datang, Cum tiba-tiba menabraknya dari depan.","Trong ánh mắt kinh ngạc của người đến, Culum bỗng nhiên lao đầu vào.",,
AvgDialog_19062_Content_42,agNu,avg章4_AvgDialog_C_M.csv,281,AvgDialog,Content,,弗朗西斯一时间无法稳住身形，库姆突围而出，跃向深不见底的黑暗。,"Francis momentarily lost her balance and Koum broke through, leaping into the endless darkness.","Фрэнсис не смог удержать равновесие на мгновение, Кум рванул вперёд и прыгнул в бездонную тьму.","Francis no puede mantener el equilibrio, y Kum se escapa hacia la oscuridad insondable",フランシスは一時的に姿勢を保てず、クムが突破口から飛び出し、深い闇へと跳躍した。,"프랜시스는 일시적으로 자세를 바로잡을 수 없었고, 쿰은 돌파하여 보이지 않는 어둠으로 뛰어들었다.","Francis perd l'équilibre, Kum s'échappe et saute dans l'obscurité","Francis kann sich nicht stabilisieren, Kum bricht durch und springt in die bodenlose Dunkelheit","Francis perdeu o equilíbrio, e Kum escapou para a escuridão",ฟรานซิสไม่สามารถทรงตัวได้ในชั่วขณะ คูมพุ่งทะลุออกมาและกระโจนเข้าสู่ความมืดมิดที่ไร้ก้นบึ้ง,Francis sesaat tidak bisa menstabilkan dirinya. Kum terobos keluar dan melompat ke dalam kegelapan yang tak berdasar.,"Francis không thể ổn định thân hình trong giây lát, Kume bứt phá ra ngoài, nhảy vào bóng tối sâu thăm thẳm.",,
