Key,ShortKey,Source,Row,Module,Field,Character,CN,EN,RU,ES,JP,KR,FR,DE,PT,TH,IN,VI,,
AvgDialog_19046_Content_4,agJf,avg章4_AvgDialog_C_M.csv,793,AvgDialog,Content,萝坦,如果我想敷衍地回应你，我就会告诉你这是力量的绝对差距。,"If I wanted to brush you off, I'd just say it's an absolute gap in power.","Если бы я хотел небрежно ответить тебе, я бы сказал, что это абсолютная разница в силе.","Si quisiera darte una respuesta superficial, te diría que es una diferencia absoluta de poder",もし私があなたに適当に答えるつもりなら、これはパワーの絶対的な差だと伝えるでしょう。,"만약 내가 너에게 대충 답하려면, 이건 힘의 절대적인 차이라고 말할 거야.","Si je voulais te répondre vaguement, je te dirais que c'est une différence de force absolue","Wenn ich dich oberflächlich abspeisen wollte, würde ich dir sagen, dass es ein absoluter Machtunterschied ist","Se eu quisesse te dar uma resposta evasiva, diria que é uma diferença absoluta de poder",หากฉันอยากตอบคุณแบบผ่านๆ ฉันคงบอกว่ามันเป็นความแตกต่างของพละกำลังโดยสิ้นเชิง。,"Jika aku ingin meresponsmu dengan tidak serius, aku akan memberitahumu bahwa ini adalah kesenjangan mutlak dalam kekuatan.","Nếu tôi muốn trả lời qua loa, tôi sẽ nói rằng đây là sự chênh lệch tuyệt đối về lực lượng.",,
AvgDialog_19046_Content_5,agJg,avg章4_AvgDialog_C_M.csv,794,AvgDialog,Content,萝坦,可事实并非如此。\n你的身手足够敏捷，战斗技巧也相当纯熟。,But that wasn't the case.\nYour movements are swift enough and your battle techniques are quite adept.,#N/A,#N/A,#N/A,#N/A,#N/A,#N/A,#N/A,#N/A,#N/A,#N/A,,
AvgDialog_19046_Content_6,agJh,avg章4_AvgDialog_C_M.csv,795,AvgDialog,Content,,萝坦提剑缓行，经过希洛的身侧。,"Lotan walked slowly with a sword in hand, passing by Helot's side.","Ротань медленно шагает с мечом в руке, проходя мимо Шило.","Lotan marcha despacio, pasando junto a Helot",ロタンは剣を携えゆっくりと歩み、シロの側を通り過ぎた。,로탄은 검을 들고 천천히 걸어가며 시로의 옆을 지나갔다。,"Lotan a avancé en tenant son épée, passant à côté d'Hilote",Lotan ging langsam mit dem Schwert an Helot vorbei,"Lotan caminhou devagar com a espada, passando ao lado de Hilota",โรแทนถือดาบเดินช้าๆ เดินผ่านชิโลอย่างช้าๆ,"Lotan perlahan melangkah maju dengan pedang di tangan, melewati sisi Helot.",Lơ-tan cầm kiếm đi ngang Hiro.,,
AvgDialog_19046_Content_7,agJi,avg章4_AvgDialog_C_M.csv,796,AvgDialog,Content,萝坦,但你太迷茫了，你还在寻找自己战斗的意义。,"But you're too lost, still searching for the meaning of your battle.","Но ты слишком заблудившийся, ты всё ещё ищешь смысл своего боя.","Pero estás demasiado confundido, todavía buscas el significado de tu lucha",だが、あなたはまだ迷っており、自分自身のバトルの意味を探しています。,하지만 당신은 너무 혼란스러워서 아직도 자신의 전투의 의미를 찾고 있습니다.,"Mais vous êtes trop perdu, vous êtes encore en train de chercher le sens de votre combat","Aber du bist zu verwirrt, du suchst immer noch nach dem Sinn deines Kampfes","Mas você está muito confuso, ainda está procurando o significado de sua luta",แต่คุณหลงทางเกินไป คุณยังคงค้นหาความหมายของการต่อสู้ของคุณอยู่,"Tetapi kamu begitu bingung, kamu masih mencari makna dari pertempuranmu.","Nhưng bạn quá bối rối, bạn vẫn đang tìm kiếm ý nghĩa trong chiến đấu của mình.",,
AvgDialog_19046_Content_8,agJj,avg章4_AvgDialog_C_M.csv,797,AvgDialog,Content,萝坦,在铁路桥时，你曾沦为无知的怪物……你被链接者背叛了，对吧？,"At the railway bridge, you became an ignorant monster... You were betrayed by your Linker, right?","На железнодорожном мосту ты стал жертвой монстра... Ты был предан ссылкой, не так ли?","En el puente ferroviario, te convertiste en una criatura ignorante... fuiste traicionado por el enlazador, ¿verdad?",鉄道橋で、あなたは無知のモンスターに……リンク者たちに裏切られたんだね？,"철도교에서 넌 무지한 몬스터가 되어…… 링크에게 배반당했지, 그렇지 않나?","Sur le pont ferroviaire, tu es devenu un monstre ignorant... tu as été trahi par le lien, n'est-ce pas ?","Auf der Eisenbahnbrücke wurdest du zu einem unwissenden Monster... Du wurdest von den Verbindern verraten, nicht wahr?","Na ponte ferroviária, você se tornou um monstro ignorante... Você foi traído pelos conectores, certo?",ตอนที่อยู่บนสะพานรถไฟ คุณเคยกลายเป็นสัตว์ประหลาดที่ไร้การรับรู้... คุณถูกผู้ที่เชื่อมต่อลิงก์ทรยศใช่ไหม?,"Di jembatan kereta api, kamu pernah menjadi monster yang tidak berpengetahuan... kamu telah dikhianati oleh penghubung, bukan?","Khi ở trên cầu đường sắt, bạn đã trở thành một con quái vật vô tri… Bạn đã bị người liên kết bội phản, phải không?",,
AvgDialog_19046_Content_9,agJk,avg章4_AvgDialog_C_M.csv,798,AvgDialog,Content,希洛,！,!,#N/A,#N/A,#N/A,#N/A,#N/A,#N/A,#N/A,#N/A,#N/A,#N/A,,
AvgDialog_19046_Content_10,agIY,avg章4_AvgDialog_C_M.csv,799,AvgDialog,Content,萝坦,所以你想要向背叛者复仇，想保护搭救你的弗朗西斯。\n但战斗不该是这样的东西。,"So, you want to take revenge on the betrayer and save Francis, right?\nBut battle shouldn't be like this.",#N/A,#N/A,#N/A,#N/A,#N/A,#N/A,#N/A,#N/A,#N/A,#N/A,,
AvgDialog_19046_Content_11,agIZ,avg章4_AvgDialog_C_M.csv,800,AvgDialog,Content,萝坦,不是为了守护，不是为了复仇，不是为了求证。\n战斗就只是战斗而已。,"Not for protection, not for revenge, not for proof.\nBattle is just battle.",#N/A,#N/A,#N/A,#N/A,#N/A,#N/A,#N/A,#N/A,#N/A,#N/A,,
AvgDialog_19046_Content_12,agJa,avg章4_AvgDialog_C_M.csv,801,AvgDialog,Content,萝坦,你的世界太狭小了，所以总像灯蛾一样在意他人点亮的星点微光。,"Your world is too small, so you always fixate on the faint glimmers ignited by others, like a moth drawn to a flame.","Твой мир слишком узок, поэтому ты всегда, как мотылёк, обращаешь внимание на слабый свет, который другие зажигают!","Tu mundo es demasiado pequeño, por eso siempre te preocupas por las pequeñas luces de los demás como una polilla",あなたの世界はあまりにも狭いから、いつも他人が点した小さな光に蛾のように執着してしまう。,"너의 세계는 너무 좁아서, 항상 나비처럼 다른 사람이 밝힌 작은 빛에 신경 쓰는구나.","Ton monde est trop petit, c'est pourquoi tu es toujours attiré par la lumière des autres comme un papillon de nuit","Deine Welt ist zu klein, deshalb achtest du immer auf das Licht anderer wie eine Motte","Seu mundo é muito pequeno, por isso você sempre se importa com as pequenas luzes que os outros acendem",โลกของคุณแคบเกินไป จึงมักจะสนใจแสงดาวที่คนอื่นจุดขึ้นเหมือนแมลงเม่าที่บินเข้าหาแสงเสมอ,"Duniamu terlalu sempit, sehingga kamu selalu seperti ngengat yang terpikat pada titik cahaya kecil yang dinyalakan oleh orang lain.","Thế giới của bạn quá nhỏ hẹp, nên luôn như con bướm đêm để ý đến những tia sáng le lói mà người khác thắp lên.",,
AvgDialog_19046_Content_13,agJb,avg章4_AvgDialog_C_M.csv,802,AvgDialog,Content,萝坦,有机会的话，去见识见识更广阔的世界吧。,"If you get the chance, go and explore a wider world.","Если будет возможность, отправься исследовать более широкий мир.","Si tienes la oportunidad, explora el mundo más amplio",機会があれば、もっと広い世界を見てみよう。,"기회가 된다면, 더 넓은 세상을 보세요.","Si tu as l'occasion, découvre le monde plus vaste","Wenn du die Chance hast, sieh dir die weite Welt an","Se tiver oportunidade, explore o mundo mais amplo",ถ้ามีโอกาส ก็ออกไปสัมผัสโลกที่กว้างขึ้นดูนะ。,"Jika ada kesempatan, pergilah untuk melihat-lihat dunia yang lebih luas.","Nếu có cơ hội, thử đi khám phá xem thế giới rộng lớn hơn nhé.",,
AvgDialog_19046_Content_14,agJc,avg章4_AvgDialog_C_M.csv,803,AvgDialog,Content,,萝坦从她身边走过，继续前行着，一次也没有回头。,"Lotan walked past her and continued onward, never looking back.","Ротань прошла мимо неё, продолжила идти вперёд, ни разу не оглянувшись.","Lotan pasó junto a ella, continuando su camino, sin mirar atrás ni una vez",ロタンは彼女のそばを通り過ぎ、一度も振り返らずに、前進し続けた。,"로탄은 그녀 곁을 지나가며 계속 전진했고, 한 번도 뒤를 돌아보지 않았다.","Lotan a passé à côté d'elle, continuant d'avancer sans jamais se retourner","Lotan ging an ihr vorbei und setzte ihren Weg fort, ohne sich jemals umzusehen","Lotan passou por ela, continuou em frente, sem olhar para trás nem uma vez",โรแทนเดินผ่านเธอไป และเดินต่อไปโดยไม่หันกลับมาเลย,"Lotan berjalan melewatinya, terus maju tanpa menoleh sama sekali.","Lơ Tan đi qua bên cạnh cô, tiếp tục bước đi, không một lần quay đầu lại.",,
,,,,,,,,,,,,,,,,,,,,
Stage_7871_Name,aVec,g关卡_Stage_A.csv,127,Stage,Name,,壳中裂缝,Cracked Carapace,Треск в ракушке,Grieta en la cáscara,殻のひび割れ,껍질 속 균열,Fissure dans la coquille,Riss in der Schale,Fenda na concha,รอยร้าวบนเปลือก,Retakan di Kulit,Vết nứt trên vỏ,,
Stage_7871_Desc,aVeb,g关卡_Stage_A.csv,127,Stage,Desc,,锋锐的利刺打破绝对的圆弧，并非“刻耳柏洛斯”之物自裂隙生出。,"Sharp spines pierced through the previously flawless arc—what emerged from the rift was something other than ""Cerberus"".","Острые шипы прорывают идеальную дугу, не принадлежит Керберосу и возникает из трещины.","Una espina afilada rompe el arco perfecto, no es algo de ""Cerbero"" que surge de la grieta",鋭い棘が完璧な円弧を破り、「ケルベロス」のものではないものが裂隙から生じた。,"예리한 가시가 완벽한 원을 찢었으나, 그것은 ‘케르베로스’의 것이 아니며, 균열 속에서 모습을 드러냈다.","Des épines acérées brisent l'arc parfait, émergeant d'une fissure, pas de ""Cerbère""","Scharfe Stacheln durchbrechen den perfekten Bogen, nicht von ""Kerberos"" stammend, sondern aus dem Riss geboren","Espinhos afiados rompem o arco perfeito, não são de ""Cérbero"", mas surgem da fenda","หนามแหลมคมได้ทำลายเส้นโค้งที่สมบูรณ์ และสิ่งที่ไม่ได้มาจาก ""เครอเบรอส"" นั้นก็ปรากฏขึ้นจากช่องว่าง","Duri-duri tajam memecahkan lengkungan sempurna, bukan milik ""Kerberos"" yang muncul dari celah.","Đầu nhọn sắc bén phá vỡ đường tròn tuyệt đối, không phải vật của ""Cerberus"" sinh ra từ khe nứt.",,
Stage_8106_Name,aVrR,g关卡_Stage_A.csv,246,Stage,Name,,壳中裂缝,Cracked Carapace,Треск в ракушке,Grieta en la cáscara,殻のひび割れ,껍질 속 균열,Fissure dans la coquille,Riss in der Schale,Fenda na concha,รอยร้าวบนเปลือก,Retakan di Kulit,Vết nứt trên vỏ,,
Stage_8106_Desc,aVrQ,g关卡_Stage_A.csv,246,Stage,Desc,,锋锐的利刺打破绝对的圆弧，并非“刻耳柏洛斯”之物自裂隙生出。,"Sharp spines pierced through the previously flawless arc—what emerged from the rift was something other than ""Cerberus"".","Острые шипы прорывают идеальную дугу, не принадлежит Керберосу и возникает из трещины.","Una espina afilada rompe el arco perfecto, no es algo de ""Cerbero"" que surge de la grieta",鋭い棘が完璧な円弧を破り、「ケルベロス」のものではないものが裂隙から生じた。,"예리한 가시가 완벽한 원을 찢었으나, 그것은 ‘케르베로스’의 것이 아니며, 균열 속에서 모습을 드러냈다.","Des épines acérées brisent l'arc parfait, émergeant d'une fissure, pas de ""Cerbère""","Scharfe Stacheln durchbrechen den perfekten Bogen, nicht von ""Kerberos"" stammend, sondern aus dem Riss geboren","Espinhos afiados rompem o arco perfeito, não são de ""Cérbero"", mas surgem da fenda","หนามแหลมคมได้ทำลายเส้นโค้งที่สมบูรณ์ และสิ่งที่ไม่ได้มาจาก ""เครอเบรอส"" นั้นก็ปรากฏขึ้นจากช่องว่าง","Duri-duri tajam memecahkan lengkungan sempurna, bukan milik ""Kerberos"" yang muncul dari celah.","Đầu nhọn sắc bén phá vỡ đường tròn tuyệt đối, không phải vật của ""Cerberus"" sinh ra từ khe nứt.",,
Stage_8143_Name,aVtV,g关卡_Stage_A.csv,415,Stage,Name,,壳中裂缝,Cracked Carapace,Треск в ракушке,Grieta en la cáscara,殻のひび割れ,껍질 속 균열,Fissure dans la coquille,Riss in der Schale,Fenda na concha,รอยร้าวบนเปลือก,Retakan di Kulit,Vết nứt trên vỏ,,
Stage_8143_Desc,aVtU,g关卡_Stage_A.csv,415,Stage,Desc,,锋锐的利刺打破绝对的圆弧，并非“刻耳柏洛斯”之物自裂隙生出。,"Sharp spines pierced through the previously flawless arc—what emerged from the rift was something other than ""Cerberus"".","Острые шипы прорывают идеальную дугу, не принадлежит Керберосу и возникает из трещины.","Una espina afilada rompe el arco perfecto, no es algo de ""Cerbero"" que surge de la grieta",鋭い棘が完璧な円弧を破り、「ケルベロス」のものではないものが裂隙から生じた。,"예리한 가시가 완벽한 원을 찢었으나, 그것은 ‘케르베로스’의 것이 아니며, 균열 속에서 모습을 드러냈다.","Des épines acérées brisent l'arc parfait, émergeant d'une fissure, pas de ""Cerbère""","Scharfe Stacheln durchbrechen den perfekten Bogen, nicht von ""Kerberos"" stammend, sondern aus dem Riss geboren","Espinhos afiados rompem o arco perfeito, não são de ""Cérbero"", mas surgem da fenda","หนามแหลมคมได้ทำลายเส้นโค้งที่สมบูรณ์ และสิ่งที่ไม่ได้มาจาก ""เครอเบรอส"" นั้นก็ปรากฏขึ้นจากช่องว่าง","Duri-duri tajam memecahkan lengkungan sempurna, bukan milik ""Kerberos"" yang muncul dari celah.","Đầu nhọn sắc bén phá vỡ đường tròn tuyệt đối, không phải vật của ""Cerberus"" sinh ra từ khe nứt.",,
AvgDialog_19041_Content_1,agGz,avg章4_AvgDialog_C_M.csv,804,AvgDialog,Content,,壳中裂缝,Crack in the Shell,Треск в ракушке,Grieta en la cáscara,殻のひび割れ,외각의 균열,Fissure dans la coquille,Riss in der Schale,Fenda na concha,รอยร้าวบนเปลือก,Retakan di Kulit,Vết nứt trên vỏ,,
AvgDialog_19041_Content_2,agGK,avg章4_AvgDialog_C_M.csv,805,AvgDialog,Content,,地面突然剧烈晃动起来。,The ground suddenly began to shake violently.,Земля внезапно начала сильно трястись.,El suelo comenzó a temblar violentamente,地面が突然激しく揺れ始めた。,지면이 갑자기 심하게 흔들리기 시작했습니다.,Le sol se met soudainement à trembler violemment,Der Boden begann plötzlich heftig zu beben,O chão começou a tremer violentamente,พื้นดินสั่นสะเทือนอย่างรุนแรง,Tanah tiba-tiba berguncang dengan hebat.,Đất đai bỗng nhiên rung chuyển dữ dội.,,
AvgDialog_19041_Content_3,agGS,avg章4_AvgDialog_C_M.csv,806,AvgDialog,Content,萝坦,怎么回事？,What's going on?,Что случилось?,¿Qué pasa?,どうしたの？,어떻게 된 거야?,Que se passe-t-il ?,Was ist los?,O que está acontecendo?,เกิดอะไรขึ้น?,Apa yang terjadi?,Chuyện gì xảy ra vậy?,,
AvgDialog_19041_Content_4,agGT,avg章4_AvgDialog_C_M.csv,807,AvgDialog,Content,,墙面上的符文撕裂了。,The runes on the wall were torn.,Руны на стене разорвались.,Las runas en la pared se han desgarrado,壁のルーンが引き裂かれた。,벽면의 룬이 리프트되었다.,Les runes sur le mur sont déchirées,Die Runen an der Wand sind zerrissen,As runas na parede foram rasgadas,รูนบนผนังถูกฉีกกระชากออก,Rune di dinding terkoyak.,Phù văn trên tường bị xé rách.,,
AvgDialog_19041_Content_5,agGU,avg章4_AvgDialog_C_M.csv,808,AvgDialog,Content,,究竟是刚才制服莉莉时的无意剐蹭，还是对决希洛时受到波及，更或是达芙黛尔离开时顺手所为呢？,"Was it an accidental scratch while restraining Lily, collateral damage during the fight with Helot, or something Daffodil did when leaving?","Было ли это случайным касанием при обездвиживании Лили, или она пострадала во время боя с Шило, ещё Давдейл сделала это намеренно, когда покинула место?","¿Fue el roce involuntario al someter a Lily, o el impacto durante el combate con Helot, o fue algo casual al irse Narciso?",いったい、先ほどリリを制服した際の無意識の触れ合いか、シロとの戦いで影響を受けたのか、それともダフネが離れる際に何かをしたのか？,"방금 리리를 제압할 때 무심코 긁힌 것인지, 시로와 대결 중에 영향을 받은 것인지, 아니면 다프다일이 떠나면서 일부러 한 짓인지, 과연 무엇 때문일까요?","Qu'est-ce qui a causé cela ? Était-ce le frottement accidentel lors de la capture de Lily, ou les ondulations lors de l'affrontement avec Hilote, ou bien encore le fait que Jonquille ait été affectée en partant ?","War es das unabsichtliche Streifen, als ich Lily vorhin besiegt habe, oder bei der Konfrontation mit Helot betroffen zu sein, oder war es ein Zufall, als Narcisse ging?","Was it an accidental brush against Lily when I subdued her, or was it a ripple from the confrontation with Hilota, or perhaps Casiah's casual act upon leaving?",เป็นเพราะการเสียดสีโดยไม่ได้ตั้งใจตอนที่ลิลลี่หรือเปล่า หรือว่าเป็นผลกระทบจากการต่อสู้กับชิโล หรือว่าดาฟเดลทำไปอย่างไม่ใส่ใจตอนที่เธอกำลังจะจากไป?,"Apakah itu goresan tidak sengaja saat menundukkan Lily, terkena imbas saat melawan Helot, ataukah ulah Narsis saat dia pergi?","Liệu đó là do vô ý va chạm khi vừa nãy trấn áp Lily, hay bị ảnh hưởng trong cuộc đối đầu với Hiro, hay do Đào Đen Đá thuận tay làm khi rời đi?",,
AvgDialog_19041_Content_6,agGV,avg章4_AvgDialog_C_M.csv,809,AvgDialog,Content,,你记不清了。,You can't remember.,Ты не можешь вспомнить.,No lo recuerdas,あなたは思い出せない。,당신은 기억이 나지 않습니다.,Tu ne te souviens plus,Du erinnerst dich nicht mehr,Você não se lembra,คุณจำไม่ได้แล้ว。,Kamu sudah lupa.,Bạn không còn nhớ rõ.,,
AvgDialog_19041_Content_7,agGW,avg章4_AvgDialog_C_M.csv,810,AvgDialog,Content,,但那已经无关紧要了。,But that no longer matters.,Но это уже не важно.,Pero eso ya no importa,でも、それはもう重要ではありません。,하지만 그건 이미 중요하지 않다.,Mais cela n'a plus d'importance,Aber das ist nicht mehr von Bedeutung,Mas isso já não importa,แต่นั่นไม่มีความสำคัญอีกต่อไปแล้ว。,Tapi itu sudah tidak penting lagi.,Nhưng điều đó đã không còn quan trọng nữa.,,
AvgDialog_19041_Content_8,agGX,avg章4_AvgDialog_C_M.csv,811,AvgDialog,Content,,从符文的缝隙中，流散出了紫色的、不定型的浓烟，在地面上缓缓汇聚成型。,"From the gaps in the runes, purple, amorphous smoke drifted out, slowly coalescing on the ground.","Из щелей в рунах вытекал фиолетовый, неопределённой формы густой дым, медленно собираясь на поверхности земли.","Desde las grietas de las runas, se escapaba un humo púrpura y amorfo, que lentamente se formaba en el suelo",ルーンの隙間から、紫色の不定形の濃煙が流れ出し、地面でゆっくりと形を作り始めた。,"부적의 틈새에서 보라색의, 형태가 불규칙한 진한 연기가 흘러나와 지상에서 천천히 형체를 이루기 시작했습니다.","De la fumée violette et amorphe s'échappe des fissures des runes, se rassemblant lentement au sol","Aus den Ritzen der Runen strömte violetter, formloser Rauch, der sich langsam am Boden sammelte","Da fenda das runas, uma fumaça roxa e amorfa se espalha, lentamente se formando no chão",จากช่องว่างของรูน มีควันสีม่วงที่ไม่มีรูปร่างลอยออกมา และค่อยๆ รวมตัวเป็นรูปร่างบนพื้น,"Dari celah-celah rune, muncul asap ungu yang tak berbentuk. Perlahan-lahan, asap itu berkumpul di tanah dan membentuk wujud.","Từ khe hở của bùa chú, khói tím đậm không định hình dần tụ lại thành hình dạng trên mặt đất.",,
AvgDialog_19041_Content_9,agGY,avg章4_AvgDialog_C_M.csv,812,AvgDialog,Content,,视觉承受了重压，神经不受控制地跳动着。\n在那扭曲的裂缝中溢出的，是形如野兽的尖锐怪物。,"Your vision is strained, your nerves twitching uncontrollably.\nEmerging from the twisted fissures are sharp, beast-like monsters.",#N/A,#N/A,#N/A,#N/A,#N/A,#N/A,#N/A,#N/A,#N/A,#N/A,,
AvgDialog_19041_Content_10,agGA,avg章4_AvgDialog_C_M.csv,813,AvgDialog,Content,拉蒙娜,这就是……,This is...,Это..,Esto es,これが……,이것이……,C'est,Das ist,Isso é,นี่คือ..,Ini adalah...,Đây là..,,
AvgDialog_19041_Content_11,agGB,avg章4_AvgDialog_C_M.csv,814,AvgDialog,Content,玩家,真正的地狱犬。,A true Hellhound.,Настоящий адский пёс.,Un verdadero sabueso infernal,本当の地獄犬。,진정한 헬독.,Un véritable chien des enfers,Ein echter Höllenhund,Um verdadeiro cão infernal,สุนัขแห่งนรกจริงๆ.,Anjing neraka sejati.,Chó địa ngục thực sự.,,
AvgDialog_19041_Content_12,agGC,avg章4_AvgDialog_C_M.csv,815,AvgDialog,Content,,这不是你第一次直面这只怪物，但现在你无比肯定：\n它就是你们调查的目标，是拉伊失踪案的真正根源。,"This isn't your first encounter with this monster, but now you're certain:\nIt is the target of your investigation and the true cause behind the disappearances in Rye.",#N/A,#N/A,#N/A,#N/A,#N/A,#N/A,#N/A,#N/A,#N/A,#N/A,,
