Key,ShortKey,Source,Row,Module,Field,Character,CN,EN,RU,ES,JP,KR,FR,DE,PT,TH,IN,VI,,
AvgDialog_19079_Content_27,agXZ,avg章4_AvgDialog_C_M.csv,540,AvgDialog,Content,赫伯特,等等！你不要命了吗？！,Wait! Are you trying to get yourself killed?!,"Подожди! Ты что, жизни своей не надо?!",¡Espera! ¿Quieres morir?,等等！命が惜しくないんですか？！,잠깐! 당신은 목숨을 하지 말아요?!,: Attends ! Tu veux mourir ?!,Warte! Willst du sterben?!,Espere! Você quer morrer?!,เดี๋ยว! คุณไม่สนใจชีวิตตัวเองแล้วหรือ!?,Tunggu! Apakah kamu tidak memperdulikan nyawamu sendiri?!,Đợi đã! Bạn có biết là sẽ chết không?!,,
AvgDialog_19079_Content_28,agYa,avg章4_AvgDialog_C_M.csv,541,AvgDialog,Content,,爆破声如同轰雷，响彻本就狭小不堪的走廊。,"The blast roared like thunder, echoing through the already cramped corridor.","Взрывной звук подобен громовым раскатам, пронзившим чрезвычайно тесный коридор.","El sonido de la explosión es como un trueno, resonando en el estrecho pasillo",爆破音は雷のように響き、元々狭い通路に響いた。,폭발음이 천둥처럼 극도로 좁은 복도를 가득 채웠다.,"Le bruit de l'explosion résonne comme un tonnerre, remplissant le couloir déjà exigu",Der Explosionsknall hallt wie Donner durch den engen Korridor,"O som da explosão é como um trovão, ecoando nos corredores estreitos",เสียงระเบิดดังก้องเหมือนฟ้าร้อง ดังก้องทั่วทางเดินที่แคบอยู่แล้ว,"Dentuman seperti guntur, bergema di koridor yang sudah sangat sempit.",Tiếng nổ như tiếng sấm vang vọng trong hành lang vốn đã chật hẹp.,,
AvgDialog_19079_Content_29,agYb,avg章4_AvgDialog_C_M.csv,542,AvgDialog,Content,,金属质的躯体四分五裂，飞溅刺入晦暗的墙面。,"The metallic body shatters, fragments scattering and piercing the dim wall.","Металлическое тело разлетелось на части, вонзившись осколками в темную стену.","El cuerpo metálico se desintegró, esparciendo fragmentos en la pared oscura",金属質のからだが四散飛散し、飛び散って暗い壁に突き刺さる。,금속으로 된 육체가 네 조각으로 부서지며 어두운 벽면에 깊이 박혔다.,"Le corps métallique se brise, des éclats s'enfoncent dans le mur sombre","Metallkörper zerbricht, Splitter fliegen in die dunkle Wand","O corpo metálico se despedaça, fragmentos cravam-se nas paredes escuras",ร่างกายที่ทำจากโลหะแตกกระจาย ปลิวว่อนไปปักเข้ากับผนังที่สลัว,"Tubuh logam terpecah menjadi beberapa bagian, terbang dan menancap ke dinding yang suram.","Thân thể kim loại tan vỡ thành từng mảnh, bay văng đâm vào bức tường u ám.",,
AvgDialog_19079_Content_30,agYd,avg章4_AvgDialog_C_M.csv,543,AvgDialog,Content,,痛楚的怪叫声在瞬间爆发，又戛然而止。,"An anguished scream erupted abruptly, before coming to an abrupt stop.",Крик боли раздался на мгновение и тут же смолк.,Un grito de dolor estalló de repente y se detuvo de golpe,痛みの異様な叫び声が瞬間的に爆発し、また突然に止まった。,기괴한 비명이 순간적으로 폭발하듯 터져 나왔다가 곧바로 멈췄다.,"Un cri de douleur éclate soudainement, puis s'arrête net",Ein schmerzhafter Schrei brach plötzlich aus und verstummte sofort,Um grito de dor explode de repente e para abruptamente,เสียงกรีดร้องที่เต็มไปด้วยความเจ็บปวดปะทุขึ้นในพริบตา ก่อนจะหยุดลงอย่างกะทันหัน。,"Jeritan menyakitkan meledak dalam sekejap, lalu tiba-tiba berhenti.","Tiếng hét đau đớn bùng nổ trong khoảnh khắc, rồi ngừng lại một cách đột ngột và hoàn toàn.",,
AvgDialog_19079_Content_31,agYe,avg章4_AvgDialog_C_M.csv,544,AvgDialog,Content,,……随之而来的是数十秒的死寂，整座疗养院中只有滚滚浓烟弥漫。,"...followed by tens of seconds of deathly silence, with only thick smoke filling the entire sanatorium.","...За этим последовала мёртвая тишина, длившаяся десятки секунд, а густой клубящийся дым постепенно окутал весь санаторий.","……Siguieron unos segundos de silencio mortal, solo había humo denso en todo el sanatorio",……その後、数十秒間の沈黙が続き、療養院全体にはただ濃い煙が立ち込めていた。,"……그와 함께 수십 초의 침묵이 찾아왔고, 전체 요양원에는 진한 연기가 가득 찼다.","…Un silence de mort de plusieurs secondes s'ensuivit, avec seulement une épaisse fumée noire remplissant le sanatorium","……Es folgten Sekunden der Totenstille, nur dichter Rauch erfüllte das Sanatorium","…Segundos de silêncio mortal, apenas fumaça densa no sanatório",... ตามมาด้วยความเงียบสงัดประมาณหนึ่งนาที ทั่วทั้งสถานพักฟื้นเต็มไปด้วยควันหนาทึบที่พัดอย่างต่อเนื่อง,"… Yang menyusul adalah puluhan detik keheningan mencekam, seluruh sanatorium hanya dipenuhi oleh asap tebal yang bergulung-gulung.","…đi kèm theo đó là hàng chục giây im lặng đến rợn người, khắp viện dưỡng lão chỉ thấy khói đặc cuồn cuộn bao trùm.",,
AvgDialog_19079_Content_32,agYf,avg章4_AvgDialog_C_M.csv,545,AvgDialog,Content,赫伯特,咳、咳，朵尔这家伙……\n幸亏我早有防备……,"Cough, cough, that Doll...\nLucky for me, I was prepared...",#N/A,#N/A,#N/A,#N/A,#N/A,#N/A,#N/A,#N/A,#N/A,#N/A,,
AvgDialog_19079_Content_33,agYg,avg章4_AvgDialog_C_M.csv,546,AvgDialog,Content,,赫伯特身前，实验体的血肉堆积成盾墙，密密麻麻的金属零件嵌入表皮和骨骼，显然已无一丝生机。,"In front of Herbert, the test subjects' bodies formed a defensive wall, with dense metal fragments embedded in their skin and bones; clearly devoid of any life.","Перед Гербертом тела экспериментальных образцов, состоящие из мяса и крови, сложились в щитовую стену. Густо усеянные металлическими деталями, вросшими в кожу и кости, они явно уже не подавали признаков жизни.","Frente a Herbert, la carne y sangre del sujeto de prueba formaban un muro de escudos, con piezas metálicas incrustadas en la piel y los huesos, claramente sin vida",ハーバートの前に、実験体の血肉が盾の壁のように積み重なり、びっしりと金属部品が皮膚や骨に埋め込まれており、明らかに生気は失われていた。,"헤버트 앞에서 실험체의 혈육이 방패벽으로 쌓여 있고, 빽빽하게 박힌 금속 부품들이 표피와 골격에 박혀 있어 분명히 생기가 전혀 남아 있지 않다。","Devant Herbert, la chair et le sang des sujets d'expérimentation formaient un mur de boucliers, des pièces métalliques incrustées dans leur peau et leurs os, manifestement sans vie","Vor Herbert türmte sich das Fleisch des Experiments zu einer Schildwand auf, dicht mit Metallteilen durchsetzt, offensichtlich leblos","Diante de Herbert, a carne e o sangue dos experimentos formaram uma parede de escudos, com peças de metal incrustadas na pele e ossos, claramente sem vida",เฮอร์เบิร์ตด้านหน้า ร่างของตัวทดลองถูกเนื้อและโลหะรวมกันเป็นโล่ มีชิ้นส่วนโลหะจำนวนมากฝังอยู่ในผิวหนังและกระดูก ชัดเจนว่าไม่มีชีวิตเหลืออยู่แล้ว,"Di depan Herbert, Caro dari tubuh eksperimen bertumpuk menjadi dinding perisai, dengan bagian logam yang tertanam rapat di kulit dan tulang, jelas tidak ada tanda-tanda kehidupan.","Trước mặt Herbert, thịt máu của cơ thể thí nghiệm chất thành một bức tường khiên, linh kiện kim loại dày đặc gắn vào da và xương, rõ ràng đã không còn chút sinh khí nào.",,
AvgDialog_19079_Content_34,agYh,avg章4_AvgDialog_C_M.csv,547,AvgDialog,Content,赫伯特,这躯体爆破成这样，不知道从里面回收的东西还有多少作用……,With her body blown up this badly... I wonder how much of the salvaged material is still useful...,"Это тело так изорвано, не знаю, насколько они полезны..","Este cuerpo está tan destrozado, no sé cuánto de lo recuperado será útil",この体がこんなに損傷していて、中から回収したものがどれだけ役立つか見当もつかない……,"이 육체가 이렇게 폭발했는데, 안에서 회수한 것들이 얼마나 쓸모가 있을지 모릅니다…","Ce corps est tellement explosé, je me demande combien de choses récupérables il reste à l'intérieur","Dieser Körper ist so explodiert, wie viel davon ist noch brauchbar?","Este corpo explodiu assim, não sei quanto do que recuperamos ainda é útil",ร่างกายนี้ระเบิดจนเป็นแบบนี้ ไม่รู้ว่าของที่เก็บกลับมาได้จากข้างในจะยังมีประโยชน์อีกเท่าไหร่..,"Tubuh ini hancur begitu parah, entah seberapa besar manfaat dari barang yang bisa diambil dari dalamnya…","Thân thể này nổ tan tành như vậy, không biết những thứ thu hồi từ bên trong còn bao nhiêu tác dụng..",,
,,,,,,,,,,,,,,,,,,,,
Stage_8023_Name,aVni,g关卡_Stage_A.csv,122,Stage,Name,,秘窗,Secret Window,Тайное окно,Ventana secreta,ひそう,비밀 창문,Fenêtre secrète,Geheimes Fenster,Janela secreta,หน้าต่างลับ,Jendela Rahasia,Ô cửa bí ẩn,,
Stage_8023_Desc,aVnh,g关卡_Stage_A.csv,122,Stage,Desc,,多么幸福的沉睡，它让我的天使回到我身边。,"What a blissful sleep, bringing my angel back to me.",Какое счастливое забытье. Оно вернуло моего ангела ко мне.,"Qué sueño tan feliz, ha traído a mi ángel de vuelta a mi lado",多么幸福な眠り、それが私の天使を私のもとに戻してくれた。,"얼마나 행복한 잠이었는지, 그것은 내 천사를 다시 내 곁으로 돌려주었다.","Quel sommeil heureux, il ramène mon ange à mes côtés","Welch glücklicher Schlaf, er bringt meinen Engel zurück zu mir","Que sono feliz, trouxe meu anjo de volta para mim",การหลับใหลที่แสนสุข ทำให้ทูตสวรรค์ของฉันกลับมาหาฉันอีกครั้ง,"Betapa bahagianya tidur itu, ia membawa malaikatku kembali ke sisiku.","Giấc ngủ thật hạnh phúc, nó đã đưa thiên thần của tôi trở lại bên tôi.",,
Stage_7707_Name,aURE,g关卡_Stage_A.csv,242,Stage,Name,,秘窗,Secret Window,Тайное окно,Ventana secreta,ひそう,비밀 창문,Fenêtre secrète,Geheimes Fenster,Janela secreta,หน้าต่างลับ,Jendela Rahasia,Ô cửa bí ẩn,,
Stage_7707_Desc,aURD,g关卡_Stage_A.csv,242,Stage,Desc,,多么幸福的沉睡，它让我的天使回到我身边。,"What a blissful sleep, bringing my angel back to me.",Какое счастливое забытье. Оно вернуло моего ангела ко мне.,"Qué sueño tan feliz, ha traído a mi ángel de vuelta a mi lado",多么幸福な眠り、それが私の天使を私のもとに戻してくれた。,"얼마나 행복한 잠이었는지, 그것은 내 천사를 다시 내 곁으로 돌려주었다.","Quel sommeil heureux, il ramène mon ange à mes côtés","Welch glücklicher Schlaf, er bringt meinen Engel zurück zu mir","Que sono feliz, trouxe meu anjo de volta para mim",การหลับใหลที่แสนสุข ทำให้ทูตสวรรค์ของฉันกลับมาหาฉันอีกครั้ง,"Betapa bahagianya tidur itu, ia membawa malaikatku kembali ke sisiku.","Giấc ngủ thật hạnh phúc, nó đã đưa thiên thần của tôi trở lại bên tôi.",,
Stage_7960_Name,aVjv,g关卡_Stage_A.csv,411,Stage,Name,,秘窗,Secret Window,Тайное окно,Ventana secreta,ひそう,비밀 창문,Fenêtre secrète,Geheimes Fenster,Janela secreta,หน้าต่างลับ,Jendela Rahasia,Ô cửa bí ẩn,,
Stage_7960_Desc,aVju,g关卡_Stage_A.csv,411,Stage,Desc,,多么幸福的沉睡，它让我的天使回到我身边。,"What a blissful sleep, bringing my angel back to me.",Какое счастливое забытье. Оно вернуло моего ангела ко мне.,"Qué sueño tan feliz, ha traído a mi ángel de vuelta a mi lado",多么幸福な眠り、それが私の天使を私のもとに戻してくれた。,"얼마나 행복한 잠이었는지, 그것은 내 천사를 다시 내 곁으로 돌려주었다.","Quel sommeil heureux, il ramène mon ange à mes côtés","Welch glücklicher Schlaf, er bringt meinen Engel zurück zu mir","Que sono feliz, trouxe meu anjo de volta para mim",การหลับใหลที่แสนสุข ทำให้ทูตสวรรค์ของฉันกลับมาหาฉันอีกครั้ง,"Betapa bahagianya tidur itu, ia membawa malaikatku kembali ke sisiku.","Giấc ngủ thật hạnh phúc, nó đã đưa thiên thần của tôi trở lại bên tôi.",,
AvgDialog_19074_Content_1,agUp,avg章4_AvgDialog_C_M.csv,548,AvgDialog,Content,,秘窗,Secret Window,Тайное окно,Ventana secreta,ひそう,비밀 창,Fenêtre secrète,Geheimes Fenster,Janela secreta,หน้าต่างลับ,Jendela Rahasia,Ô cửa bí ẩn,,
AvgDialog_19074_Content_2,agUA,avg章4_AvgDialog_C_M.csv,549,AvgDialog,Content,,你和拉蒙娜沿着走廊朝东奔跑，不多时，一堵墙出现在你们面前。,"You and Ramona run east along the corridor, and soon a wall appears before you.","Вы и Рамона бежите вдоль коридора на восток, и спустя короткое время перед вами появляется стена.","Tú y Ramona corren por el pasillo hacia el este, pronto aparece una pared frente a ustedes",あなたとラモナは廊下を東に走る。間もなく、壁が目の前に現れた。,"당신과 라몬나는 복도를 따라 동쪽으로 달리고 있었다. 조금 후, 벽이 당신들 앞에 나타났다.","Vous et Ramona courez vers l'est le long du couloir, et bientôt un mur apparaît devant vous","Du und Ramona rennt den Korridor entlang nach Osten, bis eine Wand vor euch auftaucht",Você e Ramona correram pelo corredor em direção ao leste e logo encontraram uma parede à frente,คุณและรามอน่าวิ่งไปตามทางเดินไปทางตะวันออก ไม่นานนัก กำแพงก็ปรากฏขึ้นต่อหน้าพวกคุณ,"Kamu dan Ramona berlari menyusuri koridor ke arah timur. Tak lama kemudian, sebuah dinding muncul di hadapan kalian.","Bạn và Ramona chạy dọc theo hành lang về phía đông, không lâu sau, một bức tường xuất hiện trước mặt các bạn.",,
AvgDialog_19074_Content_3,agUD,avg章4_AvgDialog_C_M.csv,550,AvgDialog,Content,,白墙的高处挂着一幅简陋的幼童手绘画作，母亲抱着孩子嬉戏——\n而那曾是孩子的地方，只残留下了黑色的黏液。,"On the high white wall hangs a crude child's drawing: a mother playing with her child — \nBut where the child once was, only black slime remains.",#N/A,#N/A,#N/A,#N/A,#N/A,#N/A,#N/A,#N/A,#N/A,#N/A,,
AvgDialog_19074_Content_4,agUE,avg章4_AvgDialog_C_M.csv,551,AvgDialog,Content,玩家,没有路了？,Is this a dead end?,Нет дороги?,¿No hay camino?,道がない？,길이 끝났어요?,Plus de chemin ?,Kein Weg mehr?,Sem saída?,ไม่มีทางแล้วหรือ?,Tidak ada jalan?,Không còn đường?,,
AvgDialog_19074_Content_5,agUF,avg章4_AvgDialog_C_M.csv,552,AvgDialog,Content,拉蒙娜,不……相信你的直觉。\n进去吧。,No... trust your instincts.\nLet's go in.,#N/A,#N/A,#N/A,#N/A,#N/A,#N/A,#N/A,#N/A,#N/A,#N/A,,
AvgDialog_19074_Content_6,agUG,avg章4_AvgDialog_C_M.csv,553,AvgDialog,Content,,在迈入那面墙的瞬间，你仿佛看见墙面上的画动了一下——\n女孩的身影在刹那间出现，又重新沉入黑暗。,"As you step into the wall, you seem to see the painting move — \nThe girl's figure appears for a fleeting moment before sinking back into darkness.",#N/A,#N/A,#N/A,#N/A,#N/A,#N/A,#N/A,#N/A,#N/A,#N/A,,
AvgDialog_19074_Content_7,agUH,avg章4_AvgDialog_C_M.csv,554,AvgDialog,Content,玩家,这片空间……,This space...,Это пространство..,Este espacio,この空間……,이 공간……,Cet espace,Dieser Raum,Este espaço,พื้นที่ตรงนี้..,Ruang ini...,Không gian này..,,
AvgDialog_19074_Content_8,agUI,avg章4_AvgDialog_C_M.csv,555,AvgDialog,Content,拉蒙娜,如果我没猜错，这里是弗朗西斯的意识形成的通道。,"If I'm not mistaken, this is the passage formed by Francis's consciousness.","Если я не ошибаюсь, это коридор формирования сознания Фрэнсиса.","Si no me equivoco, este es un pasaje formado por la conciencia de Francis",もし私が間違っていないなら、ここはフランシスの意識が形成される通路です。,"만약 제가 잘못 추측하지 않았다면, 이곳은 프랜시스의 의식이 형성되는 통로입니다.","Si je ne me trompe pas, c'est le passage formé par la conscience de Francis","Wenn ich mich nicht irre, ist dies der Durchgang, der durch Francis' Bewusstsein geformt wurde","Se não me engano, este é o corredor formado pela consciência de Francis",หากฉันไม่ได้เดาผิด ที่นี่คือช่องทางที่เกิดจากการรับรู้ของฟรองซิส,"Jika saya tidak salah, ini adalah lorong yang terbentuk dari kesadaran Francis.","Nếu tôi không đoán sai, đây là đường dẫn hình thành ý thức của Francis.",,
AvgDialog_19074_Content_9,agUJ,avg章4_AvgDialog_C_M.csv,556,AvgDialog,Content,萝坦,藏得真深啊。,She hid it quite well.,Как глубоко спрятано.,Muy bien escondido,よく隠してましたね。,정말 잘 숨겼네.,"Bien caché, hein",Gut versteckt,Bem escondido,ซ่อนได้ลึกจริงๆ。,Bersembunyi sangat dalam.,Ẩn thật kỹ nhỉ.,,
AvgDialog_19074_Content_10,agUq,avg章4_AvgDialog_C_M.csv,557,AvgDialog,Content,拉蒙娜,否则我们怎么会一无所获？,"Otherwise, how could we have ended up with nothing?",Иначе почему мы ничего не получили?,"¿De lo contrario, cómo no obtendríamos nada?",それなら私たちが何も得られなかったのはなぜでしょうか？,그렇지 않으면 어떻게 아무것도 얻지 못했겠습니까?,"Sinon, pourquoi n'avons-nous rien trouvé ?",Sonst hätten wir nichts erreicht?,"Caso contrário, por que não conseguimos nada?",ไม่อย่างนั้นเราจะไม่ได้อะไรเลย,Bagaimana mungkin kita bisa tidak mendapatkan apa pun?,"Nếu không, làm sao chúng ta có thể trắng tay?",,
AvgDialog_19074_Content_11,agUr,avg章4_AvgDialog_C_M.csv,558,AvgDialog,Content,玩家,远方的光……,That light in the distance...,Далёкий свет..,La luz en la distancia,遠くの光……,먼 곳의 빛…,La lumière au loin,Das Licht in der Ferne,A luz distante,แสงจากที่ไกล..,Cahaya di kejauhan...,Ánh sáng từ xa…,,
AvgDialog_19074_Content_12,agUs,avg章4_AvgDialog_C_M.csv,559,AvgDialog,Content,拉蒙娜,是意识空间的主人内心最深的执念，不能遗忘之物。,It is the deepest obsession of the owner of this consciousness; something that cannot be forgotten.,"Это самая глубокая навязчивая идея хозяина пространства сознания, то, что нельзя забыть.","Es la obsesión más profunda del dueño del espacio consciente, algo que no puede olvidar",意識空間の主人が心の奥底に秘めた執念、忘れてはならないものである。,"의식 공간의 주인이 가장 깊이 간직한 집착이며, 잊을 수 없는 것입니다.","C'est l'obsession la plus profonde du maître de l'espace mental, une chose inoubliable","Es ist die tiefste Besessenheit des Bewusstseinsraumbesitzers, etwas, das nicht vergessen werden kann","É a obsessão mais profunda do dono do espaço consciente, algo inesquecível",เป็นความทรงจำที่สำคัญที่สุดในใจของเจ้าของพื้นที่จิตสำนึก สิ่งที่ไม่มีวันลืม,"Ini adalah keinginan terdalam dari tuan ruang kesadaran, sesuatu yang tidak dapat dilupakan.","Là nỗi ám ảnh sâu thẳm nhất của chủ nhân không gian ý thức, điều không thể quên.",,
AvgDialog_19074_Content_13,agUt,avg章4_AvgDialog_C_M.csv,560,AvgDialog,Content,玩家,看起来像是个表盘。,Looks like a watch face.,"Кажется, это циферблат.",Parece una esfera de reloj,時計の文字盤のように見える。,다이얼처럼 보입니다.,On dirait un cadran,Sieht aus wie ein Zifferblatt,Parece um mostrador de relógio,ดูเหมือนจะเป็นหน้าปัด,Tampaknya seperti sebuah pelatuk.,Có vẻ như là một mặt số.,,
AvgDialog_19074_Content_14,agUu,avg章4_AvgDialog_C_M.csv,561,AvgDialog,Content,萝坦,那家伙难不成想做时间的主人？,Does she want to become the master of time or something?,Неужели этот человек хочет стать хозяином времени?,¿Ese tipo quiere ser el amo del tiempo?,あのやつは難不成、時間の主人になりたいのか？,그 녀석은 설마 시간의 주인이 되고 싶은 것인가?,Ce type veut-il devenir le maître du temps ?,Will dieser Kerl etwa die Zeit beherrschen?,Aquele cara quer ser o mestre do tempo?,ผู้ชายคนนั้นหรืออยากจะเป็นเจ้าของเวลา?,Apakah orang itu bermaksud menjadi penguasa waktu?,Không lẽ gã muốn trở thành chủ nhân của thời gian?,,
AvgDialog_19074_Content_15,agUv,avg章4_AvgDialog_C_M.csv,562,AvgDialog,Content,拉蒙娜,她需要太多太多的时间来完成自己的目标，所以才自我禁锢在那个房间中吧。,"She probably needs more time to achieve her goals, so she confined herself in that room.","Ей нужно слишком много времени, чтобы достичь своей цели, поэтому она сама себя ограничила в той комнате.","Ella necesita mucho tiempo para alcanzar sus objetivos, por eso se encerró en esa habitación",彼女は自分の目標を達成するためにとても多くの時間が必要だったため、その部屋に自らを閉じ込めたのだろう。,그녀는 자신의 목표를 이루기 위해 너무나 많은 시간이 필요해서 그 방에 스스로를 가두었을 거예요.,"Elle a besoin de beaucoup de temps pour atteindre ses objectifs, c'est pourquoi elle s'est enfermée dans cette pièce","Sie braucht viel Zeit, um ihre Ziele zu erreichen, deshalb hat sie sich in diesem Raum eingesperrt","Ela precisa de muito tempo para alcançar seus objetivos, por isso se trancou naquele quarto",เธอต้องใช้เวลามากมายเหลือเกินเพื่อที่จะบรรลุเป้าหมายของตัวเอง จึงเลือกที่จะแยกตัวอยู่ในห้องนั้นใช่ไหม,"Dia membutuhkan waktu yang sangat lama untuk mencapai tujuannya, jadi dia mengurung diri di ruangan itu, kan.","Cô ấy cần rất rất nhiều thời gian để hoàn thành mục tiêu của mình, vì vậy mới tự giam mình trong căn phòng đó.",,
AvgDialog_19074_Content_16,agUw,avg章4_AvgDialog_C_M.csv,563,AvgDialog,Content,玩家,自我禁锢？,Self-imprisonment?,Самоограничение?,¿Autoconfinamiento?,自己を閉じ込める？,자신을 구속?,Auto-emprisonnement ?,Selbstgefangenschaft?,Autocárcere?,การกักขังตัวเอง?,Mengurung diri sendiri?,Tự giam mình?,,
